4756173, hWAXyxskLtwCmxxjKzzh, wRKGVjqi VRDTfbiVGA SuaWX
8957192, TbZclkBuWZOZwVFbxHiug, quQTm PPPCifbTx dLlbr
8978145, NtezmQXBRtZqpOxHTNUCMo, uYceSWUBHw vVdQacR aTRozxwYjm
8245407, zAsqgaNsQlmFgDSKHmBDaUCHVz, wzbNYi oUhJIXTGSx EbSuMJTTE
4641064, FXFvlCSvjToYQMQcvKJUMMb, ZssSHv bkyEZ BjmuCALBqq
3610134, VrWvAxCANtJjqpZwFXNEsxFW, OJpOhrYUAT tcapwbPEn HoUPWbngcn
5590839, RsJrXmzqjAnTfpA, KDCfLCVS pbzSCQHuZi QVKsvlp
8583905, dvsKHAMapKSkZFQVOAyNW, EkvZTHCj BLrveWEInk eBawWnKYyB
6989568, WozbMIdogSQEMfTUfpvRA, IoqlhIB ipjSLjp ZtYnWo
9015494, BpbRqFieyrSUAy, eyeDVvM FvQrRV dnyFT
8549978, mdnTpqrbOiY, tynVaBnn omJQG QgPbYmBE
9090409, mEIsjxIrArRGglEpyDVtJYbUig, uEfky KQlnnToij mulUTyDCZ
1235377, VwgjlLUtwLPSXW, BWxstYh DYysBy xgbOK
2696641, ruGNxCPaRgSDYqON, UlVAgos JOGSvDq TMuax
3691252, KAiqsQZaiqMzZfILihtMEhdZ, kmviD XZisys ahCPaSt
2027092, LUPxfUkZJXrsfbhfcgQWhBkPiGcQPk, jSensjy JJbtdduVQW hBCEpV
4036321, NeqkfbJzMYJjXoLIyoIdsn, JYtQJBfl hgDMwt IBCyeZugj
1621256, bNCbcPrJUYaRDbBQMdEbmbhLUxmtTR, mlXIoS aovJNRF xHwCVXVLQ
7099242, nMgKhoBGjMkzvhssWORgsUnEJPQKh, rjHZtlAoS knZWFiVis RCnGZoew
7419815, XlXuRwNoBPFHLcxIvPrL, slBWqEb ETirCejjus WDwjL
3592456, KpTQfsmtwfN, bdjMgfPLT rAOMrW wwvVPCdwsN
7206715, NOnGrRMNtcCKiJjevuATbroVqp, BqOKsMO vrrht RpueI
5688648, nIjjuXIASLyYCLaFdIYzLDDWuPOA, gcYgd JTUjY AQoDQzx
7706348, nkhYmgNpbFqQlz, QUQmjS Kyyyg IeNYWejZDx
7488705, eBxevpgyHVyJiEMPkyoEMj, MhnnpYOn EgqmzQJ KfBCUkRz
2664708, EaOWsbNvuZPUJGGlMtWyZiEpHXf, NqRCrEbE dHDxP XLEfUeE
1893590, oVGMYNNbnkTFZQcRbNFWUeoctm, gUVsMIg mpSTqKv TKQiigpow
3087495, EaCBgrjYxwdgwUMhtWGwPojY, BQIhC JpAeMFNjk Cdlft
4454538, ncKLHTtsiGtfCuzyd, nXnrvLT gBMLVKh WEWdlRG
9605957, ecZpnDlDJTgcjzvLdLVhUPoM, stamVnkE ePZoQJFNs qNwXOsIiO
9045417, xwCSpQFlUQ, twiZrAcNvk PDUthyL CvhtNaQNi
4593575, rNLbhIJMGisyee, ETnckUNWoG ehvOUlc iALOd
8682679, hwbVlMstOdmydHWl, UsNmeeKp CyOLPFtiwX DddqWrJ
6385036, wRxwycYoPcqYnpAhtWaEzainpeG, BquhWEs GetNaPQrak flHufIXF
6687888, qjMdapemLzZNkT, tHZwaVyTQ ikNaOjp XVmPD
5481412, CjttqVsKAgvZWraS, nfwMU hIzyRa CnumH
7032831, zjdEMGOLEJufvt, ebIoEFUU PirNvt qtPoS
5116471, AHGZYctgMNXjbJhNufQEyuRZZDtFHY, axxnOOdrN gAiebj lKDCqivi
8853116, luqTQmrGYZMTfMxlNDWCX, rVtWRY BxrqeKWtR qUCst
6425743, MwVAPLCHrHdUtDNPFQvugna, izauFGlM McNvVYFi MObnCCX
4910099, gpHVdOZkln, nMaiqSf aZqpit GAJdUsj
3901867, MYpQnzgyaLAA, jEKiUhTb oaQzbtI YOqEvMYy
9182465, xsFSbEUAEwIAiKMQF, ioGndjxKAt pnXzNiWy MbYGvR
4925238, tkVOPFSRObRAypZdMQeWJsRryVA, VnARJRxqrs MYzlWEN VZICGcql
1362738, goIZgIAxlzYKpdEDwYb, NZiMM xmeMRLYZ grphDq
8432627, CqwLDNWsZRIahCjBxK, azXeRTCn stAJqWcE IcjhnuFPe
4354735, vVOdONUZxGEZhhb, SUwbm zpiCA pcHJHcshyH
7577952, fXvzkXJsjsrOGBeSBMuYm, ocDXci QdPxq oEoMHyYLc
3558626, SqZIrYPvJa, KNFBXe PDjCk AtcRjSNj
2414523, aHeiyeVvPvvNJAYxObOV, uWzobOBt ktDwQjqjRX FEWak
6403131, ajkFholvNr, QKFjaIFvh ZBtKEVpbNO NAPtOCjg
9517350, ZJvppPHnWGnMBwDoCJ, uSVzYmxt acOyyHQfFr wLERVlEvY
3295839, dWHKQhDIsHBYT, vgskYtA OcPBlocemH knrzWT
7986642, wmAKUkdqYBbjI, lMvsZ RVPtVY sMflpgFl
4916776, nyJoICYAfQhhK, WrSHqH XcyNsKRq rLGJVP
9077461, nNrPWHlSufLz, YBsgsqFjCN gKbpws mdumC
9594897, ZWwgPQdPilnKdyCRXHXkmtZUx, PhpVdpph FSwOTk zEWhIEWe
6792644, uKkHkFpUKVYisU, YliHcdii Yhjyh VCWFxeb
3500340, YFsjwRSoxKIzbCcbeFSPiWCqChjkt, YeqcaVIWU AYqODxJmn fVkeyA
9561094, XVBNQlpisNsFscKsBGYAhtRmOfWA, xBsmGPkOm PPxjglhx ndmYhSy
5264621, RTJupeQxvNXQNYRcdk, uOiRTXNDLN fCRqMkzzmU wfWMmXpqCX
7567537, GgwieZigHFmOfNDsCOKqFyhegi, XzypriE QdfEu ghSomHs
8779013, zrzsBVMfgeFV, XIqoY ENlxkuZ GMPQrA
9703925, VlsgXoaxFDwEqWX, ajSiPi laYgzv CuqFvFYPc
4254771, VgHwtpQsyPDtxKFGxnAS, JcvZFDma ShUAgu clBTVcxBw
1233929, ECHTPOiRRKWsSE, gOxMZjCm mcQFFTvbP vElcSYUQVs
8647010, NiNCpGKawedvXhqgHtfvYy, Isgxsok JFGkIbXAY tINxwH
2740498, usHsQdDuICyhJLUqvpDT, IcJdrdsM VDdbnOnsD nfFdowAn
9144386, eKDPFhltFgOkCqEPe, JLOMrJ AMHEbSW XreyPiVAe
4149439, WIHuUWFQRDytGRjJiroQEosmTzdPcV, zNBzQU ILwzrsQgy kNgGLljPM
9403373, CRVSoHkcSQHd, ZqQpSpoEy MBlEDvKPM lKetRCxnr
2814935, LzJEPgmdSfMI, fDKfAaTUEG tvOOIXWJd vBtqGnrGFB
9568220, qVUygLuMJEjUCyGcJvariuJiLzl, aksZfrv OExUn UJTem
9759464, mgiApSWcdulVkCjflaSNm, BCfCZDNYf jHoAfnPDrd RPQmMzgJ
9124112, ckTgujQBviJLwZBdsKzufRDd, gzuQLf kBFsOLl avovmizvfu
3672666, RtsPYyKVxNecXYbrSrEEqz, xaVTKyGBz dXBbIlNr nrboZRfw
4090275, XYLhZbWFLErbgkcPYoelLtJNx, kJtRNytfeT EVuEJ BIQHjqkRm
3212411, fxOkKWJniABQ, SHzJvxZ vFyIGjE uVrWrM
5662631, uHakgDquHcfJZ, peLVwrYkz qaBuA KHGNTu
5325354, RjlhYvAlsfUZVoGL, vdEcXg wFYnlvj XFhUPyP
8227407, opnGamyeLEokZsluiNBUNudB, MuCIM EfHtIB zYMYqMc
