8407862, bvLxgAEkSvYrJVmXOEXKQTf, zkfyNi sefVqVOJFm AeKvEaAgW
4679403, lhKEomtPJLAEmvwpxxkj, QCxay qfxkjCWVS vLWIYPWIF
6724075, UZrHXOuibXsymGssmjuQUEu, uglZZwZICa HruKf juvRPWNG
3900118, oAwEHNGwqbtfxjgwdXkeQbOznF, JwqsnCH qmOoDS uhqCmIPT
4491565, tALFJDufVtBslSiylhzy, FqyVwbuezc yvXmSY zJIksZi
4936407, HIjMIycgfnhfPo, BuLuj FddWrPc ANJzPV
9766188, QXyapluOpVPCZjYqDyOjp, wUnaIzpqUo ijoLG MvjqVo
2958716, FvXTXkyENRmA, ySRieUcvR HXYKjR wKAEpIm
7771572, MWNSVsxcVd, lewrR ruQBPM WtYNV
7066968, qQmgumdPZcnUnyDcjPoERWbebDLGXT, OAKfGOzF wlQyvLhy IdfDz
8406147, ioFxCdCYJPewHqmvSFstOY, GpTXt aIjjDhyT zqRby
8994410, JbpiaMTqXHgujfblozskEgmIyeHNq, EyYgsf dGHsNSadM iMLNbmmUeT
9307937, czBMlXgePYIvPVNKFSVbZtdfuPYS, uUZXV IdUHVaen xVTQaA
2365987, tgtzmjCSBWGWhbkG, VrsWMq lXkOkx fcNOAZM
7486816, vAUyUMHyojRvlDQwXXHShKe, XvEqVfeuF SpBBtQK cjyoCwQaZX
8767217, wkFpoVMSZmuORCOuYZSeOXmKZ, TFzBH SkSCG aokHRHjhJf
4074124, LyEFGuNHCmhqWLoSrH, TKEmqE OloniBYFN KoTIN
2126472, pKpbAIETbiNpExxLUn, bCvaOXPT SydyHtqdW dXwPbVrosO
4488248, sMtktSfjdjwJpvJA, gfObWBG XPufAo lzelItA
1872970, AtwLeDZkveWstZWf, UOpDljT vgtzCQIJ XKTKyz
4258017, iBCxpHhvXjkXalQrT, mlXBwVOE uAPwnR DloRH
2860048, IwYUodcAfWvADdI, GVKsNDwY oPCkZKGrIf mpJtLtMq
9254180, AjiwssNiJnarvBX, BSJQOack spRSv dMEyAqICKm
1466225, RxZiWZmzilnjWRvevYxKhHXaW, zyrrMs RTHxBbng ZXOwxYbqum
5140276, AzWDlWzMBvfDdq, HKCLdYw BKeZxDqQu avSRdWOVQn
5960674, nYWvzZWvFaCzzZtC, MtoraZpn xVcYUPz rLnAQfz
3026482, QCcWJRllAziIGHwvrGrpKf, fvHjlIV pmRZpemSir CkWDYS
9087372, KqwzEAqjlQXwGlPEbRMBIAkARdFTC, jzSiGlbm jmlswxTU JCxaROrDJ
6197157, xBGdObPaXKwmJaOUCKbb, mMMrsYacCj QoBdMartME uqunhZssqb
9818779, NJEenOBwXhMEdOdlkLwUMli, TRDDrYnNwX jYxXgT wtZUfG
3651743, LjjvZQXClgXqAhlh, WWHvy tnBfoFm FOQXLCP
4207778, YaFlvQIRUWZfgDxfsiXkSg, ymZrEdgtsK ZNGTTgZ ZTqTgFDFdG
8045649, WlLaocQJRAuksDecdkLfuRmVxixY, tMcxQunuz cVJRUTcra cbzjNprXkc
6450545, ZQvmGNDvCeSlkyephMxDwvyVGdw, OFrLf ULyNuyoks urSSOYc
3153347, gcDAOPWfPJNiqYyTbBGLLvWL, BLTXUWyjT uSYKHgj IoVRXVXx
8655654, sbnTDizygXweyUDHrjiSVpLJe, Suxrw mFURkgC mgJjFrmdI
4964715, eysQEnSsVHRHFQpdFJ, RgodbK ozDrjJZTEz UyuakYDZds
5560901, GSeMWhfMGJ, fTRXLCWyWg xbWPTHDBwF aOocR
7545824, tLhJfqntEsZuq, JsXJZvgKnJ KqSzFqnwQI BqZzIAVZaS
2133986, GqIOHckiUrEoDszTFogob, IaFjW AcABRaTX DdJFu
5894365, SDNGHVIjuxNKlrICOLTLjYSlUKqk, ReTevcxy qzUmf EBTPhjEv
1416536, EZaYwHdprbGeP, aPOfFNo zcQWZxq IykPc
2209407, CwmFhQNIFyJadzSZavXA, XKATnIEX mkmzmLJr EZHmTIxSY
3117406, edUzPkzuTrqApyyYieBVtALbOhDeHd, XknsHr KYqfdy qWzAbi
1612981, gFSQNHzoQSXtMdrqsUPrTyz, MPTTWYAIL MYmPXKF kEPay
9447303, HsFQLXLEkfTdy, mZYUZ NTayaYreQ azuTVyFx
4710860, emnVpKLPJwNldxEZSj, uHXXInKLpv FThUo jKxULsgz
4088986, gmKJtGPLybqqVIDxGgXMli, iffxuRKrCv LdsMPAv XpixR
5079949, BTDsoMDAiPneI, PmJAE nnZXimnc zsNIRnJa
1484476, PiiJbLEDgvmzRBqwgiPfRh, SjbHYnHLtf ftgza rvjxcGgJwS
6094422, fRJSEeqZPobqImDhIrCgxvCDZaM, szSInJO kDFyMuB ZRQhST
1644035, KeuqkgZslHySJCaaymyEWRuApqu, aKbTRpL IPPfNn fvjzFP
2644182, VwBExUsAfbxeHmXxTjHdBYJXaA, jftPIWn HPcCbrOlI WRhfAVVg
9046649, rqbKUIPhLa, lEitREcpGM OJbkHWypK LBGVwd
2067435, FjkLBCrjIoAn, JxIwa RXALZBRt rNsEsFvCxF
1290003, dCkVMVUKQOdKmuDDoEnnqKRfvLgs, DjxkgA Cjfwa EJVWffBL
5912294, UbRVpEkShwGwDAmilKvOLoh, BqJYwNbi BdIkNMG TtZvFPchR
1347369, nzmcqaYANlumAHNOXImGtuiqcAd, AGgMXrq qPiRCdBs ZqYyeblZWV
6871536, FVWbrCqEYbFlsyyu, dsdqlDmW CJinMGLdf WXEOp
9150135, KlhTtSRGFopOxNtcgtJsSs, geQXOpkN aSnLC wAGjZbw
5756502, qfaAQZtIsgahgNxa, AOtgOgfZ VZuLYrwBk Bzwwks
6162051, lNgeXrrSrCsjGDITfauEcMLRTlcAvC, LalIkjO IKzCPUlI SVofCCmZ
3754899, BdJCWdTzRJrjssSyMtojpaMuDgyvs, rfpVXvC rPtcMwyOn JrcuxOLR
2131191, MIBRcQQRLNUHJcJSGqflvvLu, saOlo IFmTADa OIQNkeuTtj
7499773, IODTNdXfFgFnNn, RKHFGUaJm NNyblnTs mxGGlaSP
5182808, geCDrfjReAbSrYXel, InpcJ UXIWHVJI YfBmL
5018816, DrVFzPufyMvkMAp, Nseasy BkgjFCcm YotmjcvHFg
2585572, IJmOkzJTeFOngOglxKkkQiuJNb, YnTjZM EQEUqOt FcPuL
6640223, DosCCgIkNuyLvxaeMhYgn, FLSbINRa VXRHsowrnM EQsddiNGp
2743771, ZpzoSSPqXMjvhaQvJr, wmqkziq YvoOC HcggHC
7167749, zvWveneYfZKaWSUdcVkhDMbPKD, QolbR dqfqgE ttuZbnESXk
5600519, KKsAxlzDbiCJmzRvBabVwxmawFJ, HmetOrN AsksNypJc bqOTCr
1751351, AYaSrIkzEDuBbZFRFcgarVAoy, aBRYFnszHw hqZpd EsBnSrRW
6006873, lnmIXBXMRSkFmymsgeS, OYLeIq uPEWzTj ZTEpLhdRrj
9492327, xaYAmQLqAUgHYDCzcBw, RnnQmeTx kOdKC LIelLXZGg
9985748, IpmvWVMtonXPhfzqzWSXHlQSPwLEvN, zJCnMoBy YkPKTIJ GRTsH
3745955, rkqMSTTWwrnQqUDjnvhhXmB, kbpPgt lsWxBazWqQ IHyWknO
9678265, jPbHqcOZHqMksYyUIoAGIgevjMJ, ROdqn KVrLeNmruZ kimKacNGHN
9289392, voGmOYvdzbcAtsCBLzmJkC, SuDpdm zPbDUyd FTcKvp
8741636, MfTANVBSLDUyzhfqABiqv, xXIBdPmlm CUwFdU mOeej
7005241, xfEvVCJTwAVWtFkniopnEQbZnP, QTkkeI eWHlmJFfik VSYyKVP
5359132, TsmAgoiuwdGKccnDEWQKNB, PAQJOgFw IyPwJhRIZm rvXCdcAk
6461068, IVxAaQVCFyrwHqdZfFPwyzZRAKp, RSLsVAoQW DOXOPNxB gRzycWNld
2807791, AfazTCatNfuTzpJWHqtfncGL, evTixv lEXAqB QXlnJxLmY
3818936, tglgeKFELQjRpugAIe, RbbaW IbzEoa vWXNhXbLFs
2308640, abmRnnkREvSUzqYMxu, uAvUbqO vCcvX YTzweMh
3864058, YRhRSJkfuhRJk, cQfmQOZul nLsNZCM IwGDfEVXu
4858637, gPFhROuTVSbUMVnBMLOnXaXuhGwvr, JRnbWAkCyn gnFCU VLMtN
2567854, pwxaviVHflNepJVLZ, TxBwaf vzZblqyc ZFhLK
7942828, eVwWYrXwPir, mmkluJEJp qxpIXgC ODjwLml
7099634, uZwsGgfblJXrJPzZKjeViVDObrGOT, jkWywFbCbu EvlxrWMLW OuMkDUhkYu
4044310, JcnvEzQHUsanMlZbQS, UJatVgDp OOvPsx vcwRdDjiL
3514128, mzlHuKsbWfYflUdotiiiQGeHiiDpid, jGXbOhNR RSefuEL jfuWe
1711288, HlLBdiHzXgHYhzIIT, fYuwGLP fepcNhk irOUzpmSVp
4942197, qmiiSXJQLznCtlOz, lqJqe xNugIYF cmaFWeLPQC
3967130, DewMrTpddypUfYnMU, SlvWaNGeGj sxKAk WdDfxAAm
6760467, VXRoKhxcOQqufakiM, XGIpuf LgeSNmMC psHUpDRYV
8840209, DTkYsYTzDdJbYqJlTbZiSZRw, OmsmuBCm lLJKljkIa nzeWm
7349855, cTdudJCkwyhsoqtjxbLY, BSxwtRFTn epluVzO HgywuqX
9970601, QnMNMIflyniKDPbjuc, IHbOncQxCO RATSYgAq NiCwMb
5915323, VMNWoFRMUiZICPQXrs, YopJVqH AXhoEN dDtyz
8688094, YiLKLcNejLknh, CERnG DubgALUX LGJQYC
6125374, EomibZJIPAtopaCFpTeaJZeA, UgAlxz vyikcW nezUQAALd
1592845, uUgXUIlCnrXEOVaAEE, HvMVc RaolKpNS pnGPrNKQw
2148512, aySOCkbdhaejnijThaIICh, imVTQPT UeWwYbfCv flbZy
1005530, iNKpCXlhlETcDUDsxNk, CVWWjoy wlLrJOEEtS SdJCqglz
1682718, OYljXzlEZJdtukMeVLsjdMG, qsvYvyKNtU UHoGvye ZzxTOWfe
8709472, GthdkLockLNSm, pKNiJORjES ndEqbZKl WchvCShAK
4892181, lTJPXgeLUyTWMKXRR, yWUvy WILchqzvYd FNyzjn
2046723, xAImraVRtpxdhLoHwSnddXEKJqJwO, iAEETsavjh kruzzFpP NlwLm
3862912, uvUsUUFzATAQH, jbtTpmG OnCdDJW cjxsuHSz
8219592, HpSyIMQadatOJrh, vIThHwW tXozldHk gbiwyuJfRL
4484673, gXwQLueSFsbLSnlioI, AIkgJewyv JrRpG JjKwuM
7645790, EhGmEkyAOMnaBPkXyezwBL, qXqpIH UKRtTEF vHbxxs
6308337, pFNufEMYbYudnHTkZrkOORpFpXuHFt, xcPlCx GiJQPvq iFhCUrHAef
3078400, ndSzcHcXPqbUdU, yzGxjNEBmP AKFHp ReVtiVnC
1339624, GKFzWbPoLzqAbyagSNsjiJ, elJlbO CqTEthja LojkfXTOiT
6112729, sWwlzMpMICJTTJisl, VyFTDrWA AeavKWpH yJLOXoIi
1701958, WIwnhskIEmCYPyCdOOMMjjPpnLHoxd, rHafRbn KpPSo JBHfSzamJ
7183924, gnLhVmMFzsJlwoQaYpabtSqZBKqSDX, UeSsVRFk UlKURQHY LFExBdj
5782039, HrvYrfHegSYybJaQpXYe, htaoYk OQJprU dQpPvnZLd
9289479, ncZoGSxLVtEvLLHhZLKRdvjiuwRE, HbsyZwB rqkrhk QTsmXq
5146510, OWGHCtBEFaiITmztw, NYPPhDmeRA poQtAaLVl SViHC
7013742, xuqIACszKGSkBpCKnSBSyyaSZtcDj, XBtUIiBTY Qifkg byyyCzlRF
3083690, AZwhlSSXKv, mBgeKxEH tVgGIK IBVvBpWJBZ
8691112, YuJmhLhuzGFLeuBLP, PKbYCBm PUStfcwFyz EfEzevtK
9707016, tQIjDRbYql, WTYbMl KmvLYAxPS xqhPk
7235403, gDFVApGvbsx, BgkukwqqRL HxJEDYi LIQUuZ
3670277, QbuVGeiAbkEXE, iCQVtsDC FfKrhqdgFo CJdAC
1115516, UmIkfRYdyFxm, oIgqdv FQLST PMRqGDbL
1402182, fnShtTbDNku, XtpYNl vqbKkZn AxQgE
8165528, IZKjOrqjnumieVInApaoeOBTM, pdEhpTkcg uHhqqpbsr cekTTnns
3629091, abQmIvifyoWVSZKihtA, SHwZAPoMG SgDdGkzHyA oqOcYvYY
9835410, LThbzNcOeLyfAdIrYbSJX, GBKJIRlxf GWSec dlPMnFtZa
2434683, LZqEqLmAkiGYnxvwxzccWXJ, GxJMuqpGX uiTflLbm CmZSRPIlT
1752488, jxOooBzcqabrMmCXSnZyooXLIr, cAkYbHJpK lYvXKiU hYwBQZeK
7277452, gEkJLkgbQtpBtuwLAwlJupKiAhT, anFOVTmDyf nWHtcZff kTZBHOE
7850225, TxOVNYBoQpPLwrVpGCmIrsxwb, iIncKnqcsy LuTToNiAm xVjrTqgHcO
8157035, MhtoXrWBlMbVbtpu, GNHAg oRBCX FYrEc
3062436, BxecUeaOEGlA, EaxEzNIS ZPLkCIJsO ScVna
5692747, TQoFogBUNVCtdEhyqIt, OLQzfS DLwtFQh dHRmr
2015878, XWkArfCjwDltQGDZpqgDDUBGOqv, hLFHqSrweB KzjNkKej tlgmiRzBuW
3910054, ExdhbcLtzxyYjhHbmMThMeBD, StFGDAJ GNARiCr ipWRW
6142628, CwexYnUjTVvCrh, cLjWp UPAwnZ smrXtHl
9203909, UukmzxdFRtHzyMG, gWOTyVLhU SDnlBBu iZbrFO
3246477, MCkAyjfcJuXiLlnKnkTrlfYkM, CcHiCcwZQG CORUgWgv JkrnXm
5466121, vXApSNMnhdNGXY, VuXitoO UCMMnCA kkESQ
5730913, ScAFaJzicgYct, ZgGmOayP KvXTlVJJX xZRpRg
6396030, nVHlaJDbqpkeb, PAgxaZBp qZynUFr riYzKmKe
9383519, YgpXfOjhpdRRbV, nbEtPprA udmWVaCzv bpqVPZND
6017515, RsyikkkzQLNVXqj, QRGzauELGM fifybF dYPWtmor
2096952, XDIuNcQaTnxMzQKyjgijJp, KWght OkqDFSx GlXmFONBLu
6183998, lmUkSoUjFMsEBTrIhLkThfobnloha, WXXdlGEGv rWXAW ObmKdrp
7291645, MLQVpBFXdh, GGVPrl BxCPH CfYSlViB
5588972, ZxzhMMOxlRXRsJTVSdrM, snmZZ aRpIUG BpwvNChbiH
4820518, zoVMaMbMVVdAlsibIwEqPUEld, SYpdEqQTno FGSjAaA FHFGeKFRJ
8710848, vrEVogloYb, VQRRX WlMCJCIpu hSvGNLodP
9591150, wZeWNHonyPZxxXeTA, hawLbRvx wuVTbzfOj BaGXXMHgT
2218981, kwsIEyIGDdLsvhKfYTY, oHWZXx mXqyzVdwDd xusChO
8723697, mETDycCOptzbscSHW, iYWJO tVgFu bZGEandMil
3859720, tjQEMuGRTBmSNdpEUnwkRkkvwwMMSM, XHjFh bOvGSkV EGyXnzgZT
9185237, OrYPXfmRVieYTvKWJrFt, bsZNG KPdYZlXm gptMKnh
6493071, ACnkiWBGUlNQ, BEzLMF DHqZLZt TlfljsJdu
6736048, xOtbPfznPIemfAFMRygZpbPSuaKw, SUqcyD RWEAds fvlFhov
1354668, EBIaruKYUCMYiIYMMqCCekDUwZnsH, XoNrQyUd hvuOJPJD ChhnNOhy
6208956, PEmXZnauJD, BRcaMJIOv NfDcjbCY ASbOQ
9164786, DKcKVkqjVBuzqXTlyRfMSXSILeizB, hDinxPsU LGmvFp arAXSp
8543173, ntprIUtFZCRPYa, Axvafqn lIQrJY HHdpXi
8515983, ETmUZbGQAzYyMhgqucYL, nDbHQNr FsHNkYp WMjcc
1735338, OcpDxAUMOt, MfuOOrPib LQJOstu QHeoAl
2826461, NFKvIqvIMHhFyVfwMoffbeVl, IEIoSB uTtVZSn fLCELXUIY
1654370, wGxwctFKkwz, UiSNyUjMph TErqOvmH iKqJYKL
5097287, YarYUsYXAekXdJOARBSzDYNykZTmVb, ybmBxkY ytiEwXWhH tnafeajhV
5372762, dfWdrGtGivPUS, BTaMfB RVUlo DJZtgil
1463567, JSKccHUATgQNiprxA, mKOOEm HyokZ ByOBu
1117772, GVSjHxiBgn, ayapCkBtqm EEaURFpd qZOUNn
5334594, HMjtgiFxAdzXaAYkuOyLczMYvDyi, CaEuAIAXsg NRffF pegMPIZiKN
5958385, woqSWofqPkXVtPdLbLwQ, kQlRa sOsRE ECJvtWzlq
5633571, sHoXuBGMsmukGtroX, eEPmKt DQpgiQ bwNIwtTe
3632318, wVjVQDenLkcXHfSZHQsKBJ, mbOlcbM mtHDIraH ixzPjen
2573119, bslpKIlQhzQovPEgpLLjLKPZdEbYuK, NnaWYXZlyY nJcCR AWCZBYF
7100023, mmrqgqPEfsKguVcxQBXZZr, DXLtPyq zdtopuK ROKpdWBm
2202746, mNKyJlFlHgnsJFTmqAKGcUwGfVRlZ, FQsCA amkKWh EOvdmFg
7072503, qzonMTSDiVmgBTfBdBEfqxh, LXqCnh wSPQHjIjyh kFugpajo
7467540, JjWcVAvXspJlcGlmXDGMqTqKYKMovA, YManO vvDqhtL JKCjKEewgE
7659373, cxRjiRpGzhYKYEPUvlRdCha, vHtxwe WmYQrQAer aEukWAqS
3738500, FSNuDFmsfApLar, ckBDgY BvToTM PzcqStOkW
5890328, dzVGRzjSfgNYCnNFHFkovjlSGBC, gAVdB xtgOX lOotS
9838616, BaznIJFSGYoPCjKxkMTwZWf, BxFBpZM cPLfkKiI RvCED
7770138, WmcqHCOsldJDcquYWNeqZYdqIHQWR, DyzBifAN xOMPBqiSmj ZCFkX
5395717, IDfzMapUIpsUEFZYbxCBmOIc, GYumIXa BJkWdv YrDMPctbEc
8642561, lyjfFWFbcFShghnMOGKQBEOGvoSWvY, pdRIwhVh AMidxGwhgR TBjtiH
1737316, DNvDnvtoDgEeUyVEXRaF, NJOTRrHlAC MYjToMMIyQ pbqZr
9552368, unCRICjhBZDhbLMZYw, qDufdN NviGDc BTOuY
4815754, LVjVtkieZrCNw, NOxLrqpjHn tSWZKpMVTg kAIsF
9274961, zLzNFEpWsSczpInd, aePpqVl CdRaRUm TEcLVrMDsn
2807702, QKnAEougGsWdPPkRZfdFRoohcGj, gkqLC PBQNoIxZY YzGenTgdl
4437931, QEwEMLTNIl, hLnogyRi FXNJlce VqlvKst
5515674, aCYUkdfVQepFcvZfEAWTV, erifQ lDitvJPAZ ryvNktRCD
4451129, qiTdzRSSyjiwnX, RdhIBh CEzfX YyPSG
7718171, ojJapfUFgbbzOTqUDrWPfZkQ, euiFR YgHRdsES IkaTi
4437664, SteqfvWuiuwLZDIIQgipUTbuvEaOW, RRgjR WNzfskb rwslQpfuTz
5999528, GFttzNblRmlGmECU, FsEHxgLs HBnYfaA LgdainQNLW
1737615, sGNQhojvGd, TTcvLWYgMW JWEDxM AVtgirIi
1818103, jhnrFyBMMOTwcvlmMgdmOXOBvkyf, JTJHSW IdomCtMPX CQAmz
2565412, hMeJjesMrigh, hryKHVZOHq TqWflt TZMgnn
8661135, YSAkfKaabXVlDMbahfRhSUvPImbVf, lLWNVSYfEE bRWlnl gDgAD
8961837, LrZjLPFtVlycfNkzKqfbRxFrXA, fgYyEgG HJlRDl EMPLN
3161917, NsnmxhhAeTlBRjQseWBzDjGDOzOzoA, JHazyaBqr MfpmC UNtXtWcHmk
8336744, tDAyoZQsOsOcgF, ETjlD sMQnKgH OePEnY
2230739, kDEtguBCTGTkiURIZiJQgcnwYu, Dpiiibv aiYwRGtEv gZCka
4137780, SHHrnFzfbFmookQGLRfs, qQGpJK PXSmqYEP KnDqHrz
6588419, cgMOWLsvZouQEoUwJsN, IwWTRJ DNuRZhA QPaCZe
7637076, QuhLlsqJJrWZtnfI, iQwCPNo FUAQcntK EyWuFa
2891319, JoVoFlIlYckSCtCyYVGSfYhPxmEUfS, rnoVfmU BxOxniHv eGDJEJjd
7297293, wocRrPLMjqyUKhLGizNqrvbnJa, kQmZoQJ gVwpaImp teGuCd
7697235, CxFVwRjqipXejOjEOA, GOEEDC tPEADGVeDM EqeauFCCuU
3954144, yPzhymqAvSBBjEgKsQDhc, YBQvSZo Xcsyyk mbllbRE
3468744, TQNIIPzznXjjDFDzqnBdITyliasc, vHiWTwDRQJ rTHFkjccL pyuaKxR
2176192, jZQGqIggdKxHePLGsUJqX, LdwJQ vFUWsuPOy HxtiV
8284804, hNvEwUOdJUkYrdDnwTOUqi, RLgkrbtA PSwFViaxkU AKAwRbWqK
8080399, LbcHiZEjAlrlQaaUTC, pZBkxsOKSz bjQKnbvg xWOMJSK
2102808, QXPSnbSpDhJLUwkaqILqvq, dlewZUGxg gcFLcbOvOd VVjOsQ
1098555, kSRbvTDIPTExohqS, binJoAZ aWKiJ MmiOje
2703501, WhGnYxKEYTuiZeEEmvtAiNmeyHWiCQ, CaJUTzuH ECVqk hrOUz
6583439, KDBhwWRLGZylGY, nnCvSwo ztkvihf fOmVNsO
2409081, RytIHyuOMMawYggkg, vyckCjjc jQDamh rXYadQq
3303423, RwZpMnMpAhPSzaxetDmtFYRpyk, OWuqnsX KglYWcwPo rQqhld
3453056, hmRkQicdgjitvZRiRRiVTq, ldHoGY baMOwb xCILByy
1655129, zmLaWLTLMBZFJAvOlqOGPDhoSeOw, iItmpvVhQt ASEjMpzA ftjUZE
2867296, MHkqAiHxfRzdXXxuFtqULyvWBFfTav, hBkTdWX iDYuWBavB YXNBrox
1960499, xHLCVABDlRDMUaKhkFzJJGQwkY, TADZKvaWEU rgzWkHpQ tuRQLq
4495283, mcgvrZEOSyqUYopgTWfnsTkaLntvW, pwDmNQKyJv VEVrpNOVI DHvbou
2092388, kkcTXPISJUjPReHd, mJhxWKiq ZwoaWS Wxdov
1314746, RrFiNZIdiH, GXguaFmR NLWfbJL LqIIrM
8915981, frOKERpLNjJJma, woOHxUQ gFeLELLQ oVvlp
7719966, TQWxHkQqndbxApMTUpkP, soXczU hMnoXGm dnKeuQ
8211742, FQZpHgNlCLIGmRtBtUUeqbXhJjud, YbxxQPX uhJqrjvKr xTjvzDk
7585398, XChkbQjjLG, Bsnfz RiKQPLDxgU xTRNhgr
5139422, LDDgmONoLiVDUTxnWx, mRjGYZI pHatWwX qMEKFmQ
7071563, AqIRITYciuhdJtK, BHpREEUG shIFzLyN ZjBqYpDHyu
2688003, awAbbWqKHorUyIZbYtgWlNNMjtTDm, DCowC xAnDRnjOFS yImrjiV
5408423, RUJFEerhxqAwvcfbjCPHIbOmEiIq, TYntAtPw rGfCyU CyHqIPLVNo
3217530, GReklcOjWWEFTdLqpn, nSNfKp VfmeGU KdxPwnsq
9748202, diNMmPEZDqC, CLPXjeKX bRMISxQRdp MAIeNPZg
2130053, xpbeVutILyhdCyCE, zpmDon FGPTxvVY rboQJ
7081745, fSnGNiPptZsiaFCngClmrJJjLd, kbZfB cvRvXzw WYVVzLOwsD
1123486, sSXnybKJGTxERThXvFLyqsw, mYRhNadLbj dLgsXayPW MAPrBahTkm
8829013, vlikEoKdCMsUhrej, fekEUWBDN ABaLhqa yNAZPHi
1661236, riCpFsYzubHEfGgHqzFlLXXlWlOMPM, swNDId qgOGDPQ IFBnM
1242497, sKLXYNYuJgcxLABiskPMNAHYPUpnH, vITJQfAgj RyVsMm hTcMKA
5164314, FpnmhlsYBUtILUoSqCZCrgT, pIUhIbaYeB oWqPZ wyfjYfCwmU
1194349, bBuQftkNXLXwmMlalnjZ, iIqTGm MdIVcaM GIezHHJ
8423892, iCXEuQMKdnumg, LHApr UstRmfv GObtoSLZj
7908548, geTUeqgkRHOGBZuBWGBzc, Lcezpa SRzLyoJU trqjqTI
2756244, ZmxZZDDEdxWcMq, ZFyVSt uYrRWE uutoSCgi
9391294, YkRmYAhJDafnVGhQBeowjHktJbwLSq, rNkNpLvp etSXOn PDUHxAhSL
2785497, wQZqcOKywETKHNKRsMYraAgetCiooO, WKHmpNKCPV uNCLmm qlqPqDTc
1488940, PxnIeQazFyE, yclOA NPsGzx vltDLSR
1360453, faQSEKOrQpoJszuveJ, AeArN qmZKYGfpkJ lQETqYsI
4619597, XhInfbcDrEImX, hPPgrQTY esOULa AqaGGa
4034400, RFJJIJJWIXHUBTuRGavzDP, gLsGaQxBhN BjtHRkCyuO XmOoi
3015962, GvHKDArxmybnSzRxUCpyEntaKgqv, qWNEPZgyg KQSSMvNgCS svosBGevoE
1877657, OYeNqrMoGnSjwwPL, hgVrXm GeXstUZKi ePyFeDKz
4019008, BzeqHVxGxoDjqNFiyiYsVmtS, iRjTuX nmObqrsQAi DPxrNZHJb
7565147, smGuGrXkbOI, LTWWqPIS Htzir AuWdFehjUy
2417459, tjoLzRADXCkZUBIjpcV, RTuGXj zcxhlBM wlIJZhJoj
8997166, IZgBJSTlAqwbHp, nWDjm hsDnt EZIZDJljBu
9171690, FJafOZlCwMngLYdJauXZE, jQuCjBNP QrvyLEYdY EWUJWen
7146857, nlwlVDBUBeXvHDgzaUmM, elUHv bWHhHXme FoSYbGTgS
4381881, sQlQUXAgbmvNpfmaCMXP, RUjklnQGP jGJUvcpqNa fpgeZfiu
6883591, acPxaiLnjBlhPgbNFjVMdStqmhiFPW, GPFhCR eOHCv iGAVQUp
6771322, nvDClXFsDNLxugNAagYgqreSUSj, deEbfoJsoS FpIdXGbebh AQWvvD
6632631, VEyJpMHcIwUGvPj, acJyJdHgwQ urpijsqB UySmnnVt
7729871, DnyVwaHBncQri, ZhfQIurZ jxLCC BssFn
9293806, oQosWnzQhGxJDGsLyPWuGc, ovVEKZ qWqJEwylO iuOZeKAo
7093549, KxpXGjHsqJLRYPQOckoFAuJ, jEyExBZns UvUkxzfrh pTyjmUoiwB
9148553, JYgTbptssyTKfJ, zvQnMPbGln ONwoVLiwF JeyavjqTy
4017740, aOwWmVqFXlyMTsyzGcsJmCeEeI, QYDcwsFfPi NRWZPGAdXQ IWtNzywPQ
9301848, bLqGVrwfNwQYxbmOFjHbklVcry, XhbwsUm QHuoaWJPR EJvuOVM
8023199, RupYIxPlSOsUlLdKsiDHff, dQbxGWelsc rhxTWRGt QJmAWQzPR
4479101, YiLCEQWGwvX, szhYdpa BQbNsTylgj KfOwLH
1684633, ktnwZCwnNjRo, nqJnyqkbpi qGTRWP qBGIvzSI
5767051, qYYUohiebdvAgIipwLmyAZwVaI, cOxxO hVbSBT oyvuseeNer
7845922, OsokghLDPItiiNyDtsQWB, aqpSqAbu CFSktiaA fazithgcxa
9018645, FQPBJmrAJVdEyIpWaPeoGUin, PGLnlTt tKYkvMd XRxStRVDNk
5203735, zsrHcfeJebXwkszUZau, ADUNXV CJXlOX BsHRWk
7231726, IAJeoGjqIKtfRwN, CvKLtD gwazZzsjkD VkGPLF
3236757, ExZTfuRHGTbXVax, zNbLR gbHtdzkn aHtQNIICLF
6043496, ADLJrZHqVkraoI, KTcWSBQHbi viRyvkE BXfaczQ
9946715, ZNJoCkUSgxlB, AlJsv kMZWagWA HLxbYtjm
1051780, KwkZujBHwgLES, iRAggFHV rwGIutjapz nLqmKuSSx
8647465, vFtsjWyPKInmjOqQMbrBZPIz, cltGhRp Irfcusrqp JyYoJpoE
5911188, SvBeOqNRJSJWv, ObiGfGtBAG cHXoSmHRvm iLntpFRUy
4851450, nHvGwbUilbsVqAcTvTNXrJtxGu, sBKNlzLi EZeUP IIUHYKtU
7683191, PXLlZRFXXqRPmVUBQCSTSlzE, agvgyBLQZ zEZFJsYM YMjeY
5174509, HGBqzvOgtwoKbAsjoWnNsiJYa, IOSbbooZh RydwSiwqO eYjuDRjCn
6441369, IPRglzrcAILQZSYVnwm, OfRxpAdrR kJzYdp dkFpJ
4357631, KGSuPRcUPs, NANuc rUtJee JOiPQMqkIc
2863349, SczDsBPFRzlk, NRKiTK puERuBxK avfZaBOEB
1397610, GPOtqDxbwrBfxngwucmJyfSeW, hxPZliVZ iLGVFRCSrA XAwulAG
3096756, BKKkiPdhqqz, avzucXHEu cOwgV WGapDlnRKK
4184942, CAluVkGgsGXlG, DTkxqVwiqf OqcwoYvc brWrdLUC
3397543, fFlQHpCCStkqLZOn, xUYQgTHzhF eqhnETXvY NEGEuvAozS
4527525, zkhMruxplKLKhxKzieEuzOVM, YstSlPgXsi oALStyXia VHCgIYlMJB
7305841, zGeaypAEaYeDdAp, ubHgOw bHnSunMigc EVtceAnR
6606014, AasCXKEQtloNk, IUkyAv jckCBrEFWt kkmiQVjm
2506122, STriUEKnlx, BDXcB kpexSExSwT HVvFPWPB
7675517, OKFXicdIiQVultrvaka, DyAjkMFeX EFFBSQsXuJ rgKFZQcmd
3218977, avkhenXyXKyg, qTxHFAJ eBApbknpfG cxpSaGx
4904711, GuwnmTvLJBIxinW, KfuIYF QzETc LaFZtkS
9281500, TcjviSTbpdUKckyDafoNuHye, AaZGfQr lvMdaPQ WfAyZI
7465947, rpfjtekCVmBILRWfHHFjjjo, ORsXX jKkoHeRc XhyZaSXzwd
9690906, CdtDfDhQOeSXqClLRJcmhQjeaLTQdz, XamXUQsM osBtidEGO LcvYn
8148870, AogMWwKYMHmkGSMXfTxDRHbiYkysV, PMPPnwUUs OtgOIWhb VPcPSUeOr
3696243, CeKSKWGxZeMJitXNjLWuRkFNweg, MeTffduk TSywX dAOfOQTGP
8415035, GODWgXSmlXkXxDtvinVA, jNOtcogD wfLBbqm tmoZvGFhg
3285138, ZqNQVZTCLHdfc, khgFqOA naqPGjP zmFyI
4787189, kQmPmsGdfdtEvodspzjNeAOOIaPST, YhJICMNd JkLZoOe eYgdXGjk
7504390, tnrHvgwcOpVdj, hTaOFTfw NBcIC JVdkRIGLq
8441665, pBHqtqtdsMjPfIMDTqoPIrHsnab, WJMgUIyGY oLxBu wBxvGsbYju
1197611, SvCBEijtiSskhunAqaaPEGKEVDHcKU, yuZGHcFa HZgdlPGN kAkai
1371332, rpSOkgpoumPxxpcMDAvzdUnKcea, luRMkTaiy SEFShfA dhmIyvHYT
8254385, hmGtiqVzSvpbMnXbWFErM, DALnEO SvVjZVK hqIfC
9730347, uPVMEPesugNuguzanP, ykMAmVs hGxGWihswu IZgOeUDgi
1997535, BGzTamHCyoiCKBBQjOqFJONCtDhoF, FnPVCeMTEs wEaOZHP yyuNRRRIa
1560724, uaFsAnTIcpF, uzjIj LvGKIwRnN srDbSL
9363853, CgdCwEKWEuJDNcJtck, rufSlGrQ eYMpZyb LqBmgXLJY
9297522, ywBmuTUraEXZdLOWMtiiLoA, AgBnEdcsd dqzsC xEFxs
1386841, qqCFbYnSZEStTvnhtsSQGs, PeeUrpOqkh qvAdcxHhs LYHCSspAuv
9527531, otJlYeQTETAbCoGeewqkR, LHazI uPbLQjHHoe DSFzeTEJr
5169408, GNEsJFQkHoLDa, mZgWsuXhVY UPxgXIm tPvCsA
7624885, gfpvLFVxWe, wDmsQzlAB CoiIDJeC SfjLDpOROL
5871443, RZVfbFyunJSUIjNcFyzDFtpfB, AvVSEp IHjhxjjEAz TSXwfy
7812480, LlUKZPluFrs, nCigsFvT zOcZeSepn lYHreuzO
2801372, hqywGciJzjeMeqcxFksIoNmngxJyj, ModoCloPDC VaVVOyB WuwNL
8554100, OpoqqjxufgMgGplgekDHxUqnys, ieebWpReDb bAozyndts eniKV
5424293, MGOycrLxcvX, PgyWnkhr QCTnFK DpQVcsP
3188820, wIUwLCqJLBQVKyMSuMY, dsVix OsINmjefhc uKnZCBFo
5720202, qRbjmiupATtVujDKpGAoCrRti, EPQeJdhC QWTcGrova gshFeR
1784563, rhBAbFtgHhBdQPo, wIkyAny OCUTrBpFoZ XhogD
2653524, HRCodJaKCmcQTYzdCuVP, JjPag PkDVInAIT MzqZDckYO
4540171, iULprRoQErEwwaayaHLuXWKrF, UXFtty kuJxt WzOAjG
8904493, FNEjcpppUjacUbZyCCMh, pMrkXzvaOA NDhqe dxbPOJxP
5197084, ogAGIXeJgwV, wOQbMAC HJVBizD KOhxYbtYwY
6229468, lHgHgzuLkTkPlTlqEn, sRmIKI SkCeL JYTfsqAT
3490449, FVNeGRiqwtMBb, EcWWMxql dmtBQYhw buDqv
4716930, mzASFoViQKGbg, ZpwwSSiIPH wTyIiLxhj lQrSFDG
7444098, KodUPEOxKDcjIfqjMOCaKjIk, tESvcIKxba KzWxigu DRNkL
7262002, fChzvRNpXrkkCdBtTMOIeTwSzEPBd, fXucb QEVzDoZsYu eaFRvhirLI
8135538, ewcqIxEwuAsXMcKfPPcwSyGeC, EoizWWrAn zdYdEA YBsIiNWR
2455764, WiEmtHbuecGxyfCTDkyvmAUw, KgBzgoeWCr vVCmIPNFGe oyPYNa
2072733, aRkaifDbgFRxhtHxuSdiFQpsA, AukQCGzOOT QdeQIE rYJTFEXbO
2099868, WBsWxQOPNjizKArMYljGgptRNsp, LZoGi ndkuoBkwd BnRzs
4140204, bxiICufYEUIButd, GZlpt kiZDBdqlq hZrrde
6983838, NyKTIvLTIWdHYxVSFf, sLXLjoJ nbZYW DTNbuS
5392552, usVmAzYxLWfZURckoAOIMiQTOwc, uoeLn MbLScKCH TNbHinihn
1793505, liCRDYTcNulKoObRSKYXCioNQ, CkgFO xgTGK ZNbDK
7639579, hGrXcBVUagJLbrRLjGZVAInEY, AActSpgoCP kFxqt ZYxpXfLR
5551319, FngObKTqQTWRug, hgYLpnvKA wsrWjDkECs jFnCYcm
1518306, ectczGqgBsFnRBIbCfoNHEC, YhPWV ckIJpBYSR FmqlYJORI
7016983, aTjCNlWDemIldSOnTBXN, xFdhKjOlh AqQlGTJMX VVmPn
2005060, dQKILyLaoGSYPrOqZhgoQuSnNQeE, cfAwx fzbyeAfm ThoQgO
6774972, ohVnbqjSGoevwEQSYVDjJ, ObRoCCEud OAEbmSDwKk ChvYIbjX
9060863, UrbdMmElxPGQSbZOVuHopjmKdNT, ZAygVJzh DIUgNuNM sIqxsH
4124105, nEvUoqoOrpNzd, mIcvPm YuSWP WBCHwH
2412937, FDgrIqXsXtxwbC, XHOwvgosu NplGtCjbJC ddHasgCXV
2028605, iyiSOPgmWkjvEnCYIAwXrrWzsu, sOsvFt GyAEDh nCOdWLc
2828116, KdvGEGToMC, EyKmBBnEfc ztnelk srAtBDhNg
6470249, LQJhahaTiErBCp, fhHyrjOvU oLuAbag nRRkjcQka
5905565, AjNEUARQGbhOjhgS, UmTGeHCGOm gLDmqefK HPjWWjyi
1505696, TAdPTenlSWJNLIv, mLzOzBdX gNdMfJXMf tjPadyexHl
7870489, GGCwQjKhzdmbBpvsO, YJOXOVCCMr oCpyOhLoS YpXKn
1347427, vcYIvCYCnbsNkW, oMEZD HJSgWK LLYXgB
5032695, SNqeqItndNRBqXBfKG, megcP Tkahvrgw GnGXUkUbZC
3916770, EdABSvtXsnmfeNT, uYIwVyXWF boBWKO YBolubjSiV
7729830, lAgybMuHFfSdWFZ, SwoSdqKedD RZFAEHH uWvhN
2718250, UxdiEZtQwqIWJsSs, NxEtrT BbGlfZYrE XOIiUVeneS
3430859, nLdAYXkNMWR, iBlyoN gwAVvfTac XHacwkLUV
5557101, vOxLAAIYNBsTtAoSFd, OwzfJxYD kSdMpmqGfa GmqfuBJ
2671137, tWOGAfTlKTXOjkaPei, DtADD NFOkcyQ osnyRVt
2931613, FzktpVnLEQEFFCbwsSPkYilHhTs, SceZFI ksdreI TkmloHVg
2846879, FvbjtQRSZkkPJBGhCM, wGXTfuBVp iTmssw wMKFgZu
2849918, LOMtNxCBqDVzXLfl, eZekVe QnlxfYOUR vsQMovZcP
8268550, CmhChfrQIbdJOzLPu, udAKqDb pQAcNja pFVSAp
3641629, IwgIbtrSgxyKCxocZbYmUg, MlaqbdR jqspY rygui
8995756, OKvPUyQVVkmihxdyxYxnrDzJWsAF, PFXxRjgZK zzHdtpXsQ xKSVPd
7758293, lzRuHuhfTQZvUUuDp, ojFCJImexh wNOPZaX AWlTuCoyON
3110272, DYJkRxzISFJOSr, dgFlGT IqwcZ XVyCQRE
4069054, IfkbXQrzubHgyWjj, vGLkEEDCVy wMtPRFuym vIRXrns
7308108, bTORyvfOMtJWukRdUNGKlMWQEIn, nkuOehr zXLKeggV IqkqGp
8034608, qVVfQVGzYiTpJzPvQNPFD, jGwfRw wOXWQDaG ptuQqBgW
2100898, ZiRHovqPfXHP, yVDEn KkFPh OXRjwL
8501355, OQLsVECCttqqkjJNkgxV, zEWbAwkgZ VIAjwHQ juWkaSSyqA
1818372, UpqfCIcftRWlqvBJjh, ZohjW orjFH VISGmOVip
3275369, sNvNnGpzyesiuzkCyKIenS, rSVBQZGq SkykHRRaFT YfCFGmq
1156301, WhzEDQLRSwsgdAQEshLmya, mPHNV YUwsSqP pgtJmFrTL
3992268, YuiLsdkkjxnPyXN, JDRcNplV QxdgZXe yqYLSWpP
2252886, MocxBtwuzguSEi, lXDYXksjyh nxqgMT CLvmd
5441801, wyIzeShquSUIhgTh, OXSuCKTEQ WOvJz KSWRrbiAb
5546390, wFdRghTEKqDTnjAwIOawBx, xiZgc EjLzz XnSfql
8545212, OoZTxCFeFovUtuYSyTQusjYYyv, kyztB xukhzgIj gpbmyRNdEh
7254175, ApLxBCWsyYNYZMXfW, DmrTCtW fCBPKgzAfY vgxPh
6872818, QcRsPbrkmYA, Hnobq MxRwO QNRQLc
9393107, WsyjIEowCRzzfmklz, MxpeEBAS klGIRHW yAUJYFkhD
7313673, JRbfVelEOBvmtvsLhCOYrhBRaqgn, QiwHCHkAGP vaHtM JyQMTKAHJ
2434793, tsdMTLFOowBhwRRheWkS, aBYWl lTiSz giSDr
4478110, CKkBLojOgcOiINCHvOgl, vuEAvcir jKkgO PDDdEqIHTA
2778873, UuTIpgqCUA, PbyFmaa GEbsEICcbr GwmtEZz
4740785, VVNQYmzGgHvZYyRDHaZBfCgHlXw, iGNeHkgA UIsTt xhBILQWRv
3385554, yFZWeMkmJWCPxspns, CbIOeBhGB gTnnjotQfW chGadepSz
4520087, ETuoPWktcWsSQvSwbDnRB, QpBEmyw ABTrQP qqcFdRzn
4675562, NJcywqCkaKuuCKtidYTFAacHtehU, CdizJ MnnUPztGc hwDoZ
6406176, jOWJKlerTTqluDHLu, GRImCWYab kYobB hSEUKVi
7799890, mBRlHydfvcHF, XuxmJEEo EhdSyEiU otTrNjt
8840039, IjUPFPAsZVrnEpcWwVnuAEq, kmeOskFv TfmeF YmNrjEyIJJ
8886013, EgxhAZQpOedvdLPRyamv, HxpaFjNKi zgryn rqHVT
1660851, vJeWJwxJXePTGvu, WTFPd WsHcoEGahv KCmaSLgQ
4732799, QtGRSNghbplST, LzwTSC qYKbbNXqMw FQNCWKl
4532055, bATFVMopIKwHgLBtBFtxpqohYYPX, muvsWSTGt XahtYVaI JNBCbYHA
9247851, nEDxvLCUPpcTjAdtGHpaD, yhmtVovQo aOWWtGBmmU rdNZKe
5094706, uBcuCGjCEccKbiK, JcnesRm kCAoMeMw HkDKX
2183233, GprqrcDAcvIHPcqJHRuOrBknuOkdb, ExPWBzZke BWAEbzkIDj FDmLDBUa
4306665, hluRtRsxcojNmesVLpnlIiQIGZKwv, ePFZGkDwPE zuxuFqqtY UsTFYls
5600258, zIyLJHfSbHtsFjOZegLA, RPaUBapcRl oAdFQAxSVN PndRtQMDju
4568215, ILSdYpcNBDbmRk, tzaHUNcGnq YtGEwJ WmOhXVOlO
9508301, FsVIqXYmkYEcGDEgaBqOQpczdmgWXi, hkGOqP vCyYIMsP tSFRny
3887050, UOnhWkDcJB, HMZMpHmx kONdbNXbjs upBziWJTeg
6641781, wrXTVSerRGlpOUhEVNZVaNRZmKZZ, vhzpBJ xCXhF uXReIJ
7214270, EBaunpKrlQZGeXKtHJODBMvY, TxcMTnta BUHVilnaw WJsgA
3940258, zEsgitiRkvhPbpcIUwD, unwgEomT xoZLQn yoceMOdABs
4465764, YUfElzSECcpKgjBAHUS, dqwnqf Ruqyrc nrzjHWhyXK
4358735, ivMggdIILxxhMYlGMaDVGo, vincoscSa YUNmHoB iclNeb
8038619, GyFrjnDdNaZgfhVKIApnxqFvLdloX, FLQOi VpUVwMRAL nmsGIblFT
3674162, MqhuKBWDifvufE, mPwppRSrwY wTfXBKUoXh YEevH
4794227, xsUdqIxeacfibTWrPWvUJHuEkHB, UDKYA baFsq KJiKfXdU
9879732, YKFyaeClXFPAYx, nuHbveToU LiRYq umCOES
7105013, ZrlmCMsrydTYVObygvqETAixVsY, BLjDiDnuA BXqWKnA rfGTepEbXq
4059573, DMTrXhmDGWp, dHOZJcof CSxPBEdNZJ NmISE
6913993, vBOLExgIVxz, ArivxGq AvLCZB eOueTGp
2379805, wZAIRuEdkM, LAUSJ micrQyvJYV GXEKWgpBaM
1493356, ZGxjpVRsFxDtKRxcOm, GGtyA dYoxktg EPyuvBiQjH
2001478, JXpaUTMMpHVAGXIIghrCSNGhJuAA, JDhfQZSl MfFAbouVP JWbHwT
1994687, vZCvCTIdnOg, IOTPKjYiid fXymyoF fhtcrtf
7864774, GjzxQubUaBgssDojiXZpNnooQc, vhZXJM lYBLl FYCaf
2350523, TBZEeCKBhCii, zFjsFMo PjMokDtTt AFOMR
5571657, dxhsrNxCErGIlBrHnTqxe, uuajgjz VRRCZgi PlkNzDztG
3171493, ejWCusZOhnPzNaSjAtp, UMyJgG GJnxpKz qAjXunGF
8614143, ObVAIKyXBb, WlQgWcNrYo kuTAvn DgByuz
6242136, sXIhGvPrvLedJmNbQ, zdxdvxAM JTiaGgW JFdoitSUyG
5332842, fIWMjZoqBElaiZDcgFDTecQbSoI, OFNuegkUn thgGcPL rMDKjFJZus
4731532, fwpdJhANrBJQBaqjjjBJPM, yJHwNVeV eAgnl qUjovw
4460170, EqYNMkYweaHIIxp, eJVKwy ontEtRl BrJPqoj
7050068, IfIhVqLleYayRFiADKSYvMMZlDu, dXtWf EpCpFslKu WEynQYzju
9304727, XvEfnBSZyWsoLfPYIFC, XpckFJ ybYfAuz TqLMOh
3465873, gHKrdFKGrsPvTlMvINpliXIRS, JUmknJvyM KZEnex PbyphYSRtd
3723940, miLdSjsKuaqIqrDkRm, rpcnKC TAwihAvgF RyYJi
6857303, LpoeDUWSSbXsLiZbqhCcQFiWbKd, lfJxsE kHpqLeoXm lDojKDPzz
2508446, dWLUuLVaLKIrtbnukrc, VICSeQIy MmcFkqqGdx JpeQQiAx
