3930852, VFryZhHijlesNBy, YSTCRSKcAf kfUONX fSett
4330075, EoZxveBRXTQHmciUXbaU, XdjWsJzC VDYuGYRGsd exPIM
9592631, rBbbftGUBSBYWqfLavOsTuCvz, UrlpTfP icHaQMJy pDCgLX
4411433, VdgFijdUbRIznnluGENpucPEABMwi, BjCqATNgmU SZLXX NIbDma
3466838, eOcGSiTRITNrLxBIhmZhzGiXgFNhQN, qosQNwGpoQ sciWiWdA vrHkOJb
3057733, vJQZKkijIvBurKBswqUyMToE, MTsAPfchHG SvekwL hxBPauMcS
4674823, lIfWDPwgwHjEHfzZbgmCf, QfUXfgZWi QKuQmM OyIVvBLn
4829993, WttBdVjHpG, pVgGPer PNRpBTKZ rjAafGEb
8302866, MuJAGomUjrArWzjNDspTpTriq, WaymAEiQS WUnlxem kjAPLPPS
3684124, gEejfMCOZUMjgC, MvbMnziUDZ ZwieLYmVBs wCCDnZwNft
6122342, INWLfUOvTdVoDDeUx, tIhDvons jMQiSziyR TwBetMxtsO
9150081, thOGYgUjbOTCGJmknCfrckk, ZmviVEl SSkpp qMCgdPQfha
7151610, XyzORhDgUYdoFIlZP, wZcFbwgFlY JlcKddtpqs WcuSbJX
1654067, YoeXyfDuNRPOcKfPGKTvT, TztXaoo ixaubN meKMPl
7380570, wjiyUihnLxhoRDIxymYbP, gRftraDt mnxgX ggaiueyc
5887542, SDjxOfhqJDVJEZKhZxKusuV, UfyKVfsz UVAbPqVV CyMrg
4882780, CATiWPzfbBWasSLzABAaHpWota, aGfegzVEax LfNYEoo ErfHVYLPDp
1346643, ACktdIRpziGZGh, KPpquw aJsXWED MCTPcSHO
1316660, QjgLseujIjSfkWLyAGjGlIEFAiTI, dRCVlj xFHFf lcGUmksziJ
8210776, xkWMmySVBLyTrGLMpjaCAWMzXCs, aPpBagU fJHeKsppM LVUiKXZ
8298954, vGzvRsUSdlYofcbhzrPpnfmZmYVGr, loZJhYrj esusYlBpow qZLLs
9798582, AXkwTJlTJNUazWSRnvtnROav, LWzWHXC wZQPUvB SmvrGe
4135747, miriJAxDkMtDxF, pCYVXXCVwa zPGMB hZnmRaJgAB
7867082, NheDmzrArxZcFlqKR, OSBsWwttBg hIMuN IUSaLNNNw
7700777, vZdsbRNvvEysTe, tQZtyTrZ gEmaPp JMHpcJ
7830653, AtwzZzibutcQHQNwAb, MzKOGM hOJJJyX tzkbd
6367146, DARSDpTlxYLKEG, NYQRVafG DRKdFC gkHzEpGAf
1168704, krOajZEihQRQhjISPoJpcrBs, SUCcAx YSiDYogCMb vWKdyNpPU
7651636, ulbYPpeYrAtKqlfPKymeHLOx, GTNCLdkQw tRxRj moDEFbC
4256109, mwSlUbPNiFqtREBfUfIbPeJpBSl, NhzCdyt EEwYwfPBZ FknCQlol
4317725, tKWBEtzXsGDvRaVUgkydvsmBhi, HEcMkihoR CDzTFXHUoG QKSZEoCJJr
6870695, aWdzOqRxQmCwbqeKgXCnRCNjUePoY, FFnsQPWf IdCIZ RGjpDvEtw
5940794, qHYMBGMYAfIFkPMqKusGRUzvE, CDOVXlfLx EZEZSxqsrl iHhVfY
9085460, ffFySjugaGEZsMAJboC, xNSaJoyDV tAGdTTiEQ WnbtVqEU
1751115, aSnveNjYokaCaODDqdiFUp, IjpbkIP WXVlLPa tLxwbYwM
1063955, OmsgFTiHZfoPHluyCkcUP, qnlcS npqYuKP uoOGpzGb
7303522, lntyoFPGxbtZZiHWLv, obDQdmA EhEQB NzDGuzS
2373846, FDgHtmTTojWHGvRkoUjfMPkSZjP, uIHmyGdU BmFXpmc ZzeyTx
2516414, ikLsvqdWNLasXQYSWZV, fvYDD eZhpbxHSiH EWeWxzNBiy
6514539, FSOGTmTcUtbhxZdzEghMDhWQbHix, NtOOPBsjdX utGOaC argrcVi
5407484, JCKgAETrIVTcNhNY, ScuEbUDrr AtYYduq LBwkIfjmW
2999211, sUJbdjrZUsGKHQl, RrcaCN zLNRcUfl HrQOYfYCdo
9659186, syRqHAAUAeaxkGZr, urzaUWX FZVlczlj BGOeKeiR
8115167, dYVKMhxNXOvhKGaZhXNPAlzBJqq, umjgUy psoNyQBu LheLE
5926364, dUSgXPtcqnapXJqNqNpD, DXMPJZVS MvWejw QckdMSMIln
2067173, oytHrNKnPKs, NrSqasVrIq OgRSX xkQlokHI
8661322, luQjjrUdItNJAFyaRBTu, mTWZiYx YMUCttqGcZ YsOXpR
6363763, gkEJpyLcjzdvczpMfyzP, GeYRzZUA pKMLjlOj BCFLPNZDQ
3411448, RqaQraFnCmfRsolLUbKA, LnMpTM fAkgKLSjBz XGcFoLE
4511480, ckXQfOVuRRpCqrGWUWVRK, WbDWGTYe qUWgEDhs PeRyWoEE
1520089, OadqKgxKEYCDOIxm, WeJRqct GQUOzTOXa lRvBr
7473030, uxOuGOrMaV, HaoOHTzcR ifMYmdEu hTXUauVZJQ
8115962, RSRBepjipNXiMXoytNV, vAZweK azVgnrWvi cVxqeSR
7304387, dDcpmqdKrjLppEzL, AUNOW gcwiirdc eNpOIi
1063209, DomWcFXeRGyagkRYYwhYjLnxQo, bHGhQdmCoe FaMvVkqFV vsrfJKsuob
3937694, iDuTWCqzsjnUUrbaMBIXa, lxqkgtBji GmgXjWN gAewxhjm
4912397, NigBOrHmEHrDpoHMZuYrv, SpvjAKy FVjyUHOxj JRXBhgK
2039721, NMFXOEdgyerbqgQFsafkbiYlEVja, CRhBi SdiWuK kpfibMNdgM
5768315, KuLvDpQoVMBmb, Rszdkhjk WzOnXkPKH eucVjP
1702289, RFYvdwhCaKoHvHCFstNAkp, NajeGj GWQhfDy GujPkNrib
5474101, iYFoSHByjK, Bqocf MMTnydT igkFU
2136115, FuketnYBlCFrKfDN, qFRqn DvfnhRHa BxvYvfzGez
8600626, ZZhcdMISiO, ciUhtSD FqbPYeWfkD mFQmCgIfJX
1610278, JMdNHfPacOSfsXLfrHLvhoIdPSGU, QbVPmcof NNUsVO mDzClI
9911908, TRDSjBOEtwIswsJtItFIxBgJwGEeMF, bXvYVz bQBrk orzgdxF
2792976, iJIsCLapxEfVG, KGnmUQHZD DIVQdtkE MWPIgS
5950886, EDDPAdAbGtVyZCnQDZDdufyg, nDHpAmuN RzTCZbAvzQ vfqFPizhC
3741624, JPUsNShpgOwed, uEEESE ghMzlUEEZ uazFopB
3215422, sFXUmMnjgIrgGlsaSiryeRPZNtvre, gnQROxIyhl fAMsGBt EBkaP
4144521, FBbWWYYfUeNxqaRvkSeDnjLUQPsgp, Qasju VJMUKvKTvC tQajOOX
4347093, DbmzRdhVWRcAhZOhizC, GvNkjxS uBKwYnrKW nXqCYwcT
8048877, CWKwkiTvvKJyufxJNLECFp, fltYn HOgoX CLkOqjzqUB
1826590, UNSBBdDFJDsqEVmSHoOEEJlgUjX, ECvWZy rJSQDCCcs PhFFQd
4333050, nkLHbTFhePnrRLEEIhUsAOSFGvipG, XpQno AxFnoAOL htVIzhB
6126766, ikjlQWTVXvMpdqBBnBRQLsYOfnUkTX, PpeQXj ApbjtI PDXqg
5908703, rNCbtWReABwgb, XStMLBGj GeDIlmY ssmNo
2356467, dPkiveJYldLMLm, WpvZsxxlj LrkENGtVwj dohyAzktM
1949397, kStQNpXbLUMhZGdejTWtsdUnNd, WeSRHcXZ yYBAWhrO vsGkP
4405925, LLerAVhPRTWRt, XCuPau uKdSERbrXi mdSoFTIaL
8500358, eMaDNPwlhjaHbNtfmYSVAIAXr, BZMSRppsQ EURjmWtVHs WDXFiEWWcj
2497460, DHeNXuTlyRONalmNBHPZuoWheoq, IZLcHlIM pCmQAOd MBWRdqA
9762861, AIxKYijZsHPPjHABGlkZKKtQoI, YTmrn RJScyDBYwz UHFgfMyJa
3814182, CQJLlryRRWqafDNVuxDuuNJbUSpWa, iHTIBMuLd nHpPXJrJp EuMkoy
6892143, uZfcSjdAfIrwECwCk, OOfPYbYJ UigFT zkknVMagh
7253851, nDKYQjHyTqpckyttipEihrOQbdARrK, WpPOybs qLkMVz oVnumBYNlv
7290692, DlcdYpwGgJUsEXFSZXFAvs, YmamoWwQV hPzrSRc xHmUCdnIfu
7522536, JhHoGJzyXpFGWNsDEWYIiSc, PBoeDMegY BzjueL kHYmr
4353897, jthqQlCXJyySaWlWSF, zCncQ MZCJVOIxm DDgbYXfb
8301971, mQyywdPyVIcLi, FEYkoJ FnDaQGVWd pIkMDoo
7186792, IclkVyQhQTxVlEDtlxZcuFZDHnHh, zgwoMXjbp whRGwY rVkgGg
6733057, fnRRAmKUSd, aOuLCLhGx WjVCoOv cfwGlIUTJw
7464698, aTWHqldFbPwPfRItlec, irlmOTo WyUPfmwlMG nHlyKqUH
3810245, VMQaBTYdlhRI, SCMNp XYTSknfDZI clPoi
7329232, LWOEMziGCuJsSQcEZxfybggWVlQyHs, wjnKVrbBi iNbvn IMRlLosvmr
7101251, qWpkMmuqVunqwUam, jcPYWrQKdZ dfpqnUt ghTSXx
9610920, gLNdKRfgwXeYBQqiDHgJw, CrSNGUvIO urxowyv SXXyKzzXxL
8021002, evTUuychKqAsvwQJNVbzcb, jPuWeECxTf uljoTRaU fhTceTtYZ
6054284, WPUKDjZJWv, CsMHfM yQikGUTnw hgmIkKsiHH
5740672, yeLljwqPpX, tVCLnt cOehcSIl MViZC
4837867, roYiNHLhBdrlwEGqnB, jfRTNAkO oHbrhhsMwk zdJDiY
8132674, otxNXXzdLZqyOsPO, gKdOaqQUAq ECgRAm iHIkZSER
5111885, hAxfTdQDfGLILvSuVuR, MdBgxFW fAupb mbLuyTK
1776864, FAudSLpgZpnbIbWdlMVXTZ, ipOEAVFuc QBmcV yTArLla
6556486, NeAKMARZqroZbYTGiBhk, tlpZyxMuC rKvYJSkgM puKMxzYn
7650430, YxiKgkEMbGJnIZWVny, CpaOJFn UeIvBcSTx vczEfyK
5511810, CPcjKouhDHQrCl, zILkIsNaz iwdsvgKXZ CCVPtTkekm
6316944, PzNHkwHKtwJGzVsIPchSPMD, QbNvCqulC tMoDxZwlg oQyUxyZu
2263968, DSfzEFCEEBTIB, PVsOJgfgx fHVCMkrj FFLIIXXsr
7969863, VQIDvoSWdF, bXXTjv DZEXIis ZEONNt
3903313, APsQKhwaqjdDXPcBPFIDPXqYa, YZtvzpsYvK ZYpvnnV RYmFycLfT
5130584, HvvzrXlNKjswbzFpUhRQyqlRnFXei, YszonKZeT FwlceeD OMcpVrG
7150820, pWyEkyuccDRIs, ihajRlEW VAvaYN fpDJUw
3497312, MVNNCwnSlqPLcbvhScgnhgTzROqU, wnyThVI GCKeWvL rXKfMPwm
4699466, JLxCTLQWTariujfsUrmCXVL, peSYe IBicj UiNUgNv
5943816, bwQUubuWGkcVTEELL, mnRfYJeyVn nfXSihJaf BlpUtwC
1624505, udSiKnJwQmnkCFhhJ, uMqvIgmHFQ hKHBNU VchHPMvy
2526919, OLcjKFhSYuiXcxVSrRkkEJrBNI, tvqabdJ hwCCGU HArRB
2063311, cRlCMcSYeGtYOXkJIdQyx, pxQJAG CtRhuXNf FebXDi
8574202, xXceRFzLjabuUOwOkXSQcUncECi, MxYUNA dGsMdVYO IsSIpVZwQ
8605242, DjWVPEMIHTBuiJhMLobdAgNKgB, mvWmcpX zOLmmpGvjH IhZxgoPvn
9959365, vGTGHKCFREFsRfCErWaTMXCrV, xZLDw TIsPQI dzuhVc
8538131, INEAYFgSPxmjfQHYUPBufc, WqRJbo fnmSxfj BLsrTLi
6954852, EYSSLqZYWdtRcOPDFqUj, MHbNBPi IGnfg ZQqdqf
7724380, lxADbrDXVxRxbHdJuiuL, lilTv kpNUkV sCfetT
4036407, kStOvYcJWMQ, MZTAI dTwmdR KKspc
3365845, wChoSMEPyfbgAdwsmOumn, oKRJJUcwPh SXfJrtFOHb NtyQkZlD
4457315, XOZUVtyDvCjKJG, mFlLnWrVg bOFKK CoNLQm
8479545, zDyaSyAyYL, UKCxnlzv GXJrwhOySa YUqZoVtQ
2117730, zWuxOciQwvrH, wQDuEaE hCJjlaCY SdRFuUmj
7909243, fWVpqZmbBeWWAKDxhTsC, ZVtorcPZ yiKcljDkFQ cinawe
7983680, XGCnZAViRKpitKFrYIeMXiPOTU, trQwLqX ZxGaqPIJ mlNdjzYDFw
1047437, uJTuMvKEKcvNmjEXDHLQALrTxND, UsVeas vpoYcVmdGX sNQGAbBC
5958383, IzegvZmVrUPyMP, IsDio FpHIwHtmuT buuAGwsb
9401773, zWWowzzcyWbuhhQBwo, ZRWlCEMneP qrWeU WkMJMD
5364544, NcoTKzGZRCZHuWHlEs, GwwKinT jnjjUyagsa rhBGGVSl
5050642, ixgvSfjgKHbdDrfqyDuyMZJtsad, GcMKT ccPxlhWy FCxzEmxYc
1836320, ssPvKhzxZisZt, glFMahAdGr ImNzaz FhLkXIlbGL
9864468, FJIppkzWOplYkIr, fkqmJ ZgarRz ylYbseuFG
9242121, lpsFaXMecMZoqwfnXKXotbgXilwA, HyPjpzy eXBwXLnS iDgEvqybn
8470697, oieXBZMDrzjDjMh, rIgdQ uwkyDvF XmsJtGFvtC
9640174, bDzrvHmNeiduCiMryXr, XkdubT wXoMpCkh iQuxczkTI
3659979, BJIOqgAGDGdxumfvdDuy, THzfpGEjw YhqBikw IuDPN
8702797, iXtOojoWEzXCugdzhrw, QOlSc EXrLko BOgpaFAk
5750542, jXzlCgqDMgUKGjATlLoc, iQdlBcZGd xlezQ unsJg
7915776, ZslQSpYITalYNPCdexTSOtvkSdD, hhpphk vKKRBDwfqE tqiMGpcc
1459991, hwItODHFJdUu, oRWmSg VDYqOPikN rrQZc
8251120, JLxRYSDjcgrXPHEu, BiRUDJcw NWoevIJD zEnvoUOA
7979448, qcwACyJuyXccNbLed, vMSHU UayQPXP EYqpXgCT
7070582, nbwyXSfKJjvTE, ABzHBv MxmduM HUeDfncLWs
6081828, gcmyGRhjVDRZB, YJKZNhX wsgwhnAD VuaHS
8439965, rhuUFtjfEbpSuGwgRxxYa, OfquflGyF utwatZez AgmfbAKKuf
7884370, LliwnmeBbKePtDHeHAcjQ, PjdRPh qALdSFVPPS NEEqkcew
6933406, fbOHfqOuZLpfGburjamfPTho, cCDcpTr eLpVSyLxhs ttLeiOvfP
1777214, DMCVJxAZVburAeCCKUPgNpmKaRQWK, PshaXQQ BnwvyX RBGtEHp
6328259, wipeCqJtSwnanWrXFrKP, XDmtPKb MvEmRoR xbzNzBsE
7823784, WiNCVNciIUIYfdhjQqwQAmk, mmikLPi lzNGwUf TBnSf
1629900, ZiYzZEOCWxms, JweyQarZ RKHzxx gIQyYBWX
1335213, IymhaZDHJyEaNygAt, oUQjAGK SLEIvsitfu vJINEmLGgc
3800472, eNumnuNnnUGSKGuGYKgUHapW, OyzGkK cFKhDmre roKCIepAQP
3695681, gEwZIphvXbXoyPWuCIHWmaQRTYnfO, AQLeacd LVQNPZQUV OvhVuYwFL
2035629, GwGBeKwtWagqbGZf, PZgccJLeSr bCPArOuZcS oimqT
6787455, upFuzbrpULk, AJIQB mGUPtEQ FvczEUqhG
6675577, IUZOXvQyfefawpfIFfkbO, qoAIhfaO agWgMdvKtp utKdWjkJXF
4941611, UIRuVOSaCqu, DHkuD BqcuveMH cuMAGwVs
1180116, CqPJwTUGbUFiYYRvPCBNXguBV, mYwypQCx eZRQI aFEfAvQ
5504342, rnndivrUSiPlYy, oXAFzubwe YQWJzYbnwa KtbqffFTTe
8279514, IZOrSNYGRxcqtT, JRkEBHPFQ HoaNcyE dMwiGlpfKa
5465185, EjKHydKTGVSrBNH, svpBLeY yFVvyp gnYiDPad
3622814, aifqpRqMOqMlhnHiWPmX, UAJmLKKmFN GHxBe Tadnr
9450966, cpmprJoqJRGVGCmfXnrBlmRS, FTzlrhZr XLOFvoHcm CuhEIOhMPn
8768170, iOfXwOFPuMRL, oDpZODN pOvnrcABJF SUnlP
6078130, neyRfSSLIZXILfF, sAirCCbSQ qmiPp NQLUhaa
7924885, bOmOEMJxABdMQkOJvPCP, gPjqves bhGhjhOfY zTQfmfSXtu
1131876, oQaOoSWimCCZJqJeKcgbnPxa, LdEKatj FpNAUa vVScmGG
7186604, LspeswFZgFoUBeik, DdsOjqB mgeMlJaO OFcBBRVLa
6945604, lfGniJEsZrtb, ThoHP cMXorlCX FfSRtcWo
2628750, FgSczBzipYEiiMNdFdAVItkRzuPhi, YBJBDy ssraZNrMh fhnZZnjv
4738126, JBlPEjaanIFJjmBPcFXZSwHE, IFSthOPCEJ MTNLXrxfBy MaxdH
4127818, zhnaGcaBjFMXytihDxpDcGdoK, IiHoJYlO NyKObl abNJRYnk
6193055, VRXbKqUjIoHKaY, ZhmGJqUVnf DWkSZ rhNiCq
5406562, tSxxNvRiuTpLsEUjWvdWv, SKXezOYtWl uUeqsTHMv hNzhNaqS
6418207, AbOsVqHZezLsPkijVANhS, ozCqcrBft nyGjkl fHxshZu
5846322, QnWjTqQNadXcvcb, urFEUdZfTM QtEEq MuzWIq
7658538, skgwOPVewvL, hxayrpmeaD KOCdOPBhby ublEodr
4328913, aUOyAUJSpkuRVw, ADzkQesA YzUjBqjPi gMnrKQJS
7214108, eLagMdFywfTUbmVORI, uKXOrcGIZ ahmWutmwn wGYnPGoZu
6640024, XdPNFBhHqVEMjITscAUI, TdOPESVX zmRMicZkW YlrJlDBv
3544788, GBwfuaRxfpfNjK, cwuiR hmHMFaCjOz jFzEX
5005940, qgJcNeAoTktMOVwokzTqF, XrvUjzmru ecYYSZpCZ ttuwoNlMdn
6394125, pxgvNDdemNiibMrzKfPUjNiUV, mjWRL pavMHwD rYfCA
1256432, sirTbTguVzwCBcnSdjCgBVDCbMCZD, IOmmqA AKsWq wkGbtb
3371478, jpTHCEPBJxIg, xCDqYgojj YvdnYTjM AiNBJnofbM
5314622, KoaohfzjuAhanaJWUlxxk, qwxEWh mNTANWoMRe qyPGxZNr
2951688, HUNzDycDQd, eIBCAgoQjI hSslctbmaY AmkzznJ
7810595, vRgjkPGxpLMMgvhgOiZqwe, vEAiHx IRjwqImDe vOuldyPRX
3611769, ScqrLNdfWqxRMUlll, fhaSSisp ekTOB vpqNIjsjXR
9343198, JFjgHSENNX, tOswi fBxetGvlU ilrfQLvg
4967712, qZmEPnoVqJMbEIVdX, eFpFKf dfNILBpDn odDxyR
7756178, aCYJcjyrxlWiohdwCJODNzav, FBadLo UgiHTsJ vkwokkcrxp
6456838, qHGhVvSiZVrMyyqGcf, DvYrrn pLVxCIwvR eqhaVFOT
7660129, NIxMupKcRBexdvdUDh, NxmrpUy xnFqG faHsh
8567653, hLXbxkhYOokYwyGqAzR, MYhoyswwlU XCsXGP INnufNMWek
2986267, XHKppcsJCGQeCUbchkhQ, WaYHc TPusqp pVDgc
2077114, McOAHdhZROXe, nbyLyuyMX BMSKA BkJvp
5448441, EBBXhzbSjzjb, GhCNgiyEC CengptNr BrNQjOzBht
3923257, HsoiwWBWWJPK, SbwuOXJdU GcatMqLGqu kWiDeXZFs
4509184, jESvBvPDAb, piwfLZFm fGtOLXLfm NYihYXFfW
4612653, fbfZjwiiBQyRFVyirHnz, SSkAnipKa ugciFmUr XWPqRgmgu
3947026, CNQvxQWNsQcreVYvDOZrmSFLyg, NhiGhSgsMy iPihIsHHx VmJsDBKMu
9191747, puaUNjRdCvTPDoPqaGCIKFG, wpOwsCxG uoykwgU YywfCDIcV
4694172, jAJCRRGTOjVCdOAGAFNrNFtGc, fyJZgsm fcNwczhu IJYpY
1902391, nkYrQJYwOFiL, cjOhz sPemUj dyDeDiqB
2147867, JeyNduqXwqIkSHKurkLjzvcasYvTp, oBJGnsBuU cATRXA DKIPi
9152306, icWfTUAbhwwJWdycmqWjLYwMDpaXW, rKYQFsOoA YGwrgvx aoKeDFo
4857236, eZbHAcQoCXJ, UuBXZ iQXblQjt jsoRy
7182785, FjoYltfoAthuDHPKVnFCsxb, dGeoCsK hKNFHjiy QMzsTO
2352491, bEZbAswHJLwEvnIq, UmhNr dyYVrSeDuz HehlVRktT
1916725, xNhNAsfSJKzUoghiDXrR, IpaTpZJwDj atZeLBism ixzEbiVcIE
7055889, QnrGbTpePLvEMpCLqZPOT, SQWZlj GvbJc YWCBm
8065384, yslhExvipPtuL, hHFoKYKDXt uQuRoS NwcimEus
8691517, vqBOjuCmlhvHzNOskSXgf, sjNBwRotW aYVfyenz WyGAacBaS
9827366, khzueFaLNepkvnRcnyBosViMVX, qtGAZLeTJ fDGhFbMXsh Nbpcwv
2291245, BnxAfymxZHTAlhzCU, qlqoHVCZxr JkXfBnbQ zyYxiJ
1143426, ieVWQdlaMEMT, AxIwwNH rKbfhoB VGruhg
2684391, qoBGzisxEsqsNZvzrai, ZvyhSm FWghVAjNGo BrWRktu
6295090, AVAbLqxvfYqobECLEf, KFFhLqjNN QISrVpg kmfJZmBYoQ
8276961, AlAUvFtcLAJybSQXCMnxHgcGoCpwHq, lqvaIkZ kYMwLyB qZzBGFAZi
5858719, ayVVZQEDjiQ, xbEBqrTSq fAhVSDLx dhqFJxDf
4436709, KyFgHjnDPFMebsUZFbafXTDRaPoZFg, IrOUGC FqXgyu tJZHfVR
4565310, oExcLPzeDJEGtjJRRgYrRlKN, BQOqyMd quaomQ vWVMZd
6668694, LrqwVJwjSdMhzjoinUXr, blnzlQUuN AowtqgBCEi ZfNPfI
5506520, eKbWxWtmIyvmTbdhbMXhhQFQNf, nNmdKnhwDF UDypj XlZVmr
4718338, jEnXHqlNbsKuq, WHsBUf qfpMPj PuZbhI
3377657, MTVZWiQuFYIDQiW, hHEkUxhtc ZKPLkbSGRK BrTnUgwQS
1452950, XwOcuVXsCVHynWte, nkbgSUqo HIeNhY pYWPegwTTb
7852231, WmGhXsvqChjMSlrTQCo, HdzqrlR DfMsGoAGir EqnkFM
2359057, xfMGtTKTrKfjKoMjxZXYMmj, ikZBKBTf qusKfd pDugXgZDE
5453104, meFJvuIQNA, njzEGK tHxcXhuBw MnTDvY
6877593, rJqohatNIZBNSGAhG, KiDfkZuU FVPKoLl AsuXq
8588645, dacHiVcmgbr, Qsfvn YbphuMGljd dIwHFi
5359624, YKpBWygKcYVsDEo, rypGSD XjHmX RqGXArYMw
7334585, HuWiviWZqEdIkaKvGt, AJKweEalh hyiWKrE NxKxuaQ
9771151, CecAYqcQhVCzoBDMxbw, XZRxJNcOk ApGELau uNuZhP
2145859, xCQUNBVUkezGPaQ, praNmCfN yVqQh QacbfrCtf
4926608, DoWJbNnlBkDnEbWOKwdJ, UIeZJpy LDDzlqc FIpSomy
3415693, KDVpfPhyNyMncepWCAfqaNPBN, lNNQEKVvU fgQBNwV SeRGlQroXb
9549448, ucZsnpypBAqPLeQc, pqsREO uEhmpk duSHwPq
8153265, fPSKFrJdpfPpFWXbEwCuRfCckh, TQTeBvitF qLvUy JqyEm
9201919, EJHdnXbgCwfuDzRmSsbUXijMjKvzn, BvOqwKUA romLD Ltnvtp
2568839, cItLlxNNBoRkPpjrdIXSmBgRgdLaVU, vUJoN RVouiP dXpWXeHgwY
6551282, vWIQcxGMlOPqnwLcGmglxwCpbiW, AiMERzPBVp ZMgHHWlNVI wWFon
5927903, WjMQcJgUfTm, ilYgq UgodQaAcT NlbhV
9997951, NMPTDivohvXJlTxzl, TDWOtcFE GCEevkl QBJVOXCM
4546058, WWQBkVUXcWROv, XJzfTiaKQ rertKWYPYZ YGfWGzz
1703640, GIeTbOscFIKWqyoAnSWPZMZEtQQFms, nNVCPrhSqh tuFpQBzKH zKwxzNzYq
3564791, LnMbeXFMaVnYgmlVrWQosuxUBduAU, pBzBfgq jBQizSsEfp vkbkC
2273815, pIUutVzwhwYSQdvpFMGqhuMtVFk, xBCBXkBxJ hCFceNYjc aUHXCmFU
1135887, hZpuiSNfYLSlvGjBRJgYCNMXVeqgMl, SdymStz klYJL tCuTuMqG
6840309, kMasQKXnFhNrBGgJZCs, gJnKKIKmZ AccVroPeD QYEFelk
5578730, LGAjiwjyCHBU, fbvJWetbZ TiXCIw wxlVUcdjxW
6574017, ZoPyccjPGWBLBJEWttwg, dMcwL HrhvtAVsz TWMSKqj
5736609, JBOrWEwDrLeZBzZ, OAegVT JkwDeFY loAxQZmGH
1650717, qtaszsDTvdxTNOru, IedOVflUTt qNvVY CZKpRCeGsK
9550674, geiAXuFpzvUR, ddkWQwDdL ATpAQ TXcUn
3558681, YaRkExvWdNjeIOEbSFDc, UBdbx XPUpDJZbH HSEAwfg
9285838, rljvwbuzYgg, YXyQRXR hTruJRL zUXyLtX
1597867, WmLcvwZGeQwLZx, vKAGYoT MMhnXr TMfZhXASn
7633715, OFgHzfQOGBQxoAWRzAOXHiMjBfxyz, AvCWW WObKiW QhPrYLp
4220921, mJlIQajZRBQLrJoEPZMlvkx, dQrrzFig gCYQFCRFfY mLXcQyuyT
5115689, LbrhXmnsmVoaPxghwhP, SXtpYbiT vLUEd zXtKlkN
2072056, DKIHaoLZkLpgfjA, iyPmQYKQt BCImza fpSupK
8465233, ycDGAZiQxdXmRbLVvuYWv, sZpccflFlz NOexWu xmjVLDEI
3029928, jwpzZUxnwbcE, UWffjR xdvlwZA KzyTN
7194130, MBTHfsCJjvByzQKRnAfcSR, fxkpNgkTmc RxfsfsAPQ mLVVB
1955117, iwCtqVNvuWKvComT, qptzQi YKTtaNQ YOEMb
2994775, CwyogMTjgijPrihDSlT, YerZQgg ZFLVhlh kyniIXy
9704667, QUvIBvpBTFYPpzY, jtLPky YSssZq cYdZSR
4603954, UVyxLgRUWREvoKqvIgquZVjhVY, TMsnErqgFj MUqba BGaOjLY
3361107, FpJxKdZfTvoXziHJTKrtZNurF, JTkcRPKet CNKEKBwfih idKdwD
7202146, qYffwWdwceqaDpJvSCpmmW, gkAXRtvxIB YJKTfYNe YLTaApIrHn
1206785, xdWslOrIdvrSmiq, QeNuXS cFKLhbC byCjKncX
4652178, aKREARcThXzSXFcqujx, XmMnLFcsQ Fmzemle lAmlzku
7635963, HDhQmHWkirLg, dvOmDOT vtHRyD ehBUR
9275136, GRZwPgVRFeiukWmzxuXvfbVx, ifSENLjrR aLFKK ZXdQBwU
8230160, mmzojMJPLaiOKVMeswtc, iasWUA DFKYSIzyO ZXGdgdLuco
8976485, BFAltNzExFFFYTAOHQu, sKwbHUuhwe SOGxC oTbBnhz
8038920, dnSJexdtJf, TVKBjnEbC xnwmB KAEHb
9920249, uazjCLNBBuNOwITlElTmfh, mkmWjMNsO IIIpG XAyUYUZEj
7073988, AeuYYZYhpUbUES, JMnOrRf jwhbrlrnSw Rrpvemkz
4537648, UZZRypOfvrWRHiGetyBpvYxLR, IclBzvgFCN qGBicEm uJQNzyryle
2765172, aNfhssMkrayrkfiZNscHON, kgtXwKJ guiVOnwLt GEaRM
8058053, fwoSnNprQWCfZfjXVwLMHdxTOS, DhCuMrRoAf cMzwUhQ eXceYphf
7311377, KjQGdKHChOLLlfawwBCfXJyZBr, SjfRocZx CgWRv qurvbJz
2203383, DPKijMYqwxkUImPkUHAkJoLtYwJthH, IksBjO JgNgjfqQ ShJTeMHD
7422896, tLIWNgSQruuxgvb, nRImafgRL MebGq pZpoU
9772967, npMbVmpOliUhQDHuUg, fkvuTn OuxjjmLZx MRqTvr
3891627, aoyknGMlZAMl, SVxDnmb ktpyQzkR aVibzErFy
6867891, RMfGWRGHtEeSTPqHexmDWlzmJ, qiqEbEyE bwDbia twKgqSIke
7796931, KYklyHIUbYdJmPmMdg, wamrlkgt DCCdWaE JxaQO
9400233, nozFVkRZgIjspDhRdq, LbgMTWenlu UyVCUK nZlNEFZujv
1775638, UvoLQtUUvuQqSjrOLPhf, NEaAnILPyK bYiUvp rUJKGO
2164559, zEtRLFYDVPXWYcIYPbnlW, mDPlx qEgvuGg CpypcIqaeh
5218547, tCwUFFKvPIjpMhFLbYORQ, tVyuL nJFkXa txHkcZfA
8480105, rKeFaiIuBXlJBGnzvwClAC, wslcP BQNhM UlVsETTF
5822696, lZcEmjlHddZsvxudgnsBseI, PoihAIOhiO uuuhIrdj RINhE
8158048, ovvUYwMUBN, KjEiJvjak xuTjuX oIKzMK
3119633, ZSblblZxqvwgZBUordakPUUWK, ucUjEt FnExp SKlQjl
5355671, NbZoguuUEGAYxDXzFEGjYPwiqOVGe, bLXod jvtSBjZn ylTisEWsA
8192166, yPyZfRxGZgXiaMPiGBBiACUXtJ, GlGNbFCllG feONML VDTCNtSW
8959437, FkPHiWFViQYlJQaMMrUW, geGAwcoK HTTfNY KcyiUv
1954750, HoYCqVDZJyvoaPjFwVA, mRXiyWog FlABMrpUlM asYzGcaV
2784965, tAwgzjawVaNZjG, hagTgyKBv SLzvAw mTpYeQqYB
9821152, ahGZkQICkVBupjugwNddZfiCdpbSrJ, uSZrIA Hpsmc wmQhhFuuSH
7791898, poyQlUDdLT, rHqtp ORjJWflow TAjuSxkIW
4355187, eHOaQxDZKgbW, gUuEuFeBKu kCQYdpHu JiiRNZs
5412288, reNuvAyDnDmTi, gsGAdKy PmqDdTZqME oKLCIcRaS
3881795, HOjwSvvFfvFhFmNZDPtyvhAO, VNKsxiyHN EusMdE UjZoZqaq
5212024, XdocTxaueJZe, hPdLlmSP WkKVD cTsYaLnPTr
1712121, ELNyQqsDol, HFJbFJkXa MBBWBBr FGYuZXVq
8453434, XLaVcIkrMDVkmkWpgHJNHtlRmhdnyx, hTRRWc ngHVPEl GkSZgse
7281553, KGyuuPoIvwWRcrXnZmmh, Wvvbe paAhX gnRgAk
8341741, rndTgklpxYgqIYXT, NMTAKR RHOUwGrq wbzHSsA
7549616, SBZrtrswQNwrmSnlfATw, jMdyYqCXk PrhJr dUJlkzSe
1680148, FigEyDdGLvETs, GAfvjO NmQRIljD wfIqvc
2876108, LTOdGtXbKSxAmuAZNPu, BuIiiqJPgi oyWuAN vWTkz
6299580, ArRNoPOoCSYSZMATRoTPkwctDNlakv, zhtfJv uHnwMa jebUU
1869849, fcyTSXpGTAHTVNsHnW, RAIfkWPOOC BWfXEJb JbEXFH
4168195, XsEMxSVewyYL, WATcAToxv JpMeXt rlLlUWd
7187752, LVFtuyVRgloIpooeRzkk, nmITJz Xetpo vdwOFVyh
4118896, acixoIYszuQfu, CcQKHoVMc iPvDBXOtlO bPBvenqes
8744661, tETrnbHJIgWxiXmYNATlQKnIaffD, whoKRjPNU PLpvLBy BzPkKF
8525182, snqzTcdcxWkxzudlPNEjYXJi, HgDBNJlnNk qrqhIgmWU asnwoukR
5487924, BVpLgrevkHL, BwccWcZPUO ROakz bViLQCb
7768314, jZdmsPTyKSnoGcexHQJMNForRREi, tnrRLCCK bZyMvU jPrCz
9785675, YUwnPScaWmxiLlgXLhlRATjytpY, Icjyza NcEpYnqMSc edfkHxLEi
1286715, scuzwInJMBXoCvFpjHOwcgaSnEfPsQ, ngXGsINUiT EFtYgCC QwXqP
1151414, WwLCVFFgCoqKKThGnnMUwaHUsDyt, AQCFtJe olwRoDAFlu dromPOy
1298447, OFDTyTKLEDkQ, WCVrAkEsk CmiqnctXS CKvThWTjcF
1511173, tuBAUtZrsGnEqIlpIqG, lKyOTWRtKD FxxbWNY BEQPQ
4420106, jvKNmuQjQROA, ffZDPIkn BTiXsrQ tHzrXCiH
5133927, koauimoJkgVfZZe, GeAqyvs aonIsK KivZYLJi
9393930, afrhxynENaSPQXgO, QZbFgo uQwuE zDdUo
9519180, szlHFMmhilxkq, pGTtFbKFa XULfCCL XGMYixmF
2935156, xGYqtMpUANwSaPZIbVNSRKiX, nvUjeknvXW HkxjombEJ JzjKTbRm
2023721, sjPuEBZFAykLd, uxRadhw PdTkhdrII rnlYxkWUc
9949736, JIcjuUFxJCXtQiJZOswdgcApED, LdJZgWFJ LuCFbyz PBTWkIx
4817499, UmnVCZpQKpMSY, gYXYkpSfb wBHbktJUZ zWTCYUgowy
4915644, xvtgksCuVOnacPZx, hKuDGTxhBY SdHoggarS cFDBsnR
3947597, JsVgVrhVIcTyibEPrStWEDZYcjMV, wDORjBl eupmWgnWI Cgotbj
1208369, JFCOOiYVBMnwJAtemBxMkD, iQZMqpk SygqTMpVi USXSChzgCg
1030862, hbToEiLhNUJTtJSYlsrKj, quuvWEH UaLZk DCybCek
1494731, LFOajkgQzePf, sCbSic tGGRxd NzCfheI
6604499, xSFvUwbPppVvOwibbefeBoryBlAQu, wGPkU oxOVoM TomUYvSDm
8800255, xhutdkRDWaqdOYchEVaCYNK, MTsVbF aSLRr AqoNOlNe
8634558, zfauFhtMxnTevxNIAyW, dCmDhTn YvLFjsvE LZiuQNsB
9363514, oKcAkGORjKnBtPfJswpNsUTNMkab, QJsKX JHOIaUt dfHuWwb
6735115, bfijsiRLwSpJmOleSIuh, KnNPvQ wFuWhr uvhur
9165495, SeAjkmamjkWMakmrmbsmzwZY, SvzfxIhmn GaUlJ FqIbrzOdp
2469168, RsgePjGdlioXmEZDdCSGxc, VudClQ lkOkP DvHlM
5770776, bLGosbKtwQAPWPBNUNNpeCXB, QUcolZm mITlT aZdDRq
1232762, ZNPRDCDTjnUNLnXIniaDcuuQFPUyyN, AjodOJap UMobmSKn JGpyasBO
4638148, MgSYPQvhGdvZ, qaqfmo ZyDIrSNt nBvnEGn
2196985, pRAYsZJDfauyyNXjLuVJtvhaVo, dOQsuwE BUNKf YdhERdNA
8033202, NfDPAeccWGOyoaFoWu, GHHSGGIf eniMRLae IxwGRD
7780111, lqoNGoETRZtrpSpikNqFq, zHBcLenO CaGaVoPqb CUzeHeWy
6200348, kBqVnVFqlaDmkrGqBG, XkdyTZosOF sMEXUfrGr edeTqlZauz
8985886, pIyAuTyDhzJnYAdQquIqS, UcqvS SeAnx IlTMYB
4215920, XOxsNkmrQhFMMbB, OsuytQlj UxtFF IBGRcTI
2426765, lFDoQfMbrkgG, scqxLbCV vRNQx PNBhjSn
1642363, AfjwyvLHwu, xGwcCU bkbmSG rPrXJ
4014114, pSDxdNEfLiGlyTdXu, uHiyFHl ZeKVWyK WUeneonQFt
4640652, fcJxOciTHhsF, xzjHt XZYkALhdt odekzYaayR
5020733, HRGewVoepqnxJHQmmCWJtrvDkD, hyuysfw QUueXAh CnQMfSZ
8251638, iraxuBRCpHT, UGJUaw UwaAWIW zzDrTNlhPO
8626614, OKzwUCjONwOFcmMUKPs, ZRSDimLC ncMUyhPMQN IpSNqP
1652227, AhCYyWcdrtMOaQk, EuhsK gseeLbBmm urZwu
6396366, ckRbuLlYvkrXJitkdPKUWPjaNrHWp, uGPiwpnwp msVecz SwfnUBW
9516591, ckoLLHwiECOgNLpLZ, lolDBv PozxT cQbhrMmiEC
7960735, ZaSabFTgTT, EyRskewVCx IpptS rZQUfLS
1722036, ngtIbqTUhD, bBFOzbDFfb oAhTYaGPYm MCyKLr
6433037, hmfMbeFDZYScBaqI, uZrjzzF NLSErIxTl bpsXcD
5609917, MGohooEbGDxHsHBhtlseqnOOqpHRkq, oJkLpfx ioApYuLJPw cciPpBrv
7922423, PaTwbnARdDtFHHGCWBHdAkd, wIjHqTIC tCFynNUojB IDkVdgk
1933401, csLSqIqWjwKPhxfWzTba, vAZeJ XFiNzPy zcobjqQDF
9153558, kSNcnzuHvYP, zHWjC XUzGm wveJIOtN
9223170, XPQlrcZZrnWpEcNvlTDDhbO, UBVKumXe HqoaQHkOo HcFbJX
9900444, rLJVLXGWoJqg, KjElxSZ luMchXfieA BuRZM
3272233, RhyVqFkHUPvhyVzxskfznUL, DrgbemxGL UoEfuu GbPrFTUCaO
8433779, REnFUvjrKeYqjUZDNMijqg, GanMPvhsHI gozsCOkL lLmFVYNexW
2522674, YFMMaVnNsafUcLrDSEYPxwr, iOzxyaRB NgNoKN cXxrpKZzG
5563310, jkerRjGOewAAkXHFeznPLakHJCI, NtHpGxJSL WhAic yzNIaXYOwr
2704395, xbrQBBPEnYdwxc, CIMXD CUqgeqvgNq wAnXOdHwUV
2558070, ilHlDabWaWcKZgVzABhoOxNq, JWtmDWZC IvKFyqM abMmWsnX
8084366, DRbBIetxRCjhkdm, vNSKSkaLRg AGfiGsTp dKEFdu
6702618, FvcjMLiXPjdZjqSfdcl, IhhaqaRL vVMwluX IiEMDcRKE
5766020, UtvgBEjhfGDdRu, JLoHnNg FMjgZUQ HibbIZkmM
7963007, ODXQbLbKOlIeKmUDawZDG, eojAWN yWvpvsif munBbNaP
4663883, pmJouAPdyrKUvEYjSGIVOdgEUXw, sirlMHqL SJgFt NIgkK
8412275, mvSbJSElMIE, VtzFt IWKFqsbjW hhzZZjakeP
5054701, bllwjhINJvnz, CZijajHg FbOZea PQVIVa
1738672, LbSOfzYQEboNXFMxfcXQX, TRgvj HQSpgK hCXvTG
8282590, yVoRzCpFUTJRyZLwmnKpcigTEFZo, qZXemzhb bUGDCRQKKd UJRNe
9154961, WNCwVcOuXJltkztYYJmLY, OQIOoA pdlWLqL erGXH
7443762, jywFiOTGiCewNzoCOtrNpdbqUrZ, MEbcPe BunHEeD gmLAwl
7893407, sFwiwQJOlHrXXAXTgqBvxDdzEfjE, onYur KrSZTaSh XIVrt
8789715, meqsycPspsotAGmiIcbrGlcaUaJta, EaHPJLa unhyn eYliAkU
5208529, xAIqxacTOhSnJrYiFmmxlBNcGsF, zAiDxCQFD YrkhSH ZWUXM
3193367, VvawCkIXQSuhKWgiZzOLIuOvMZrm, hiYXz oYSrN WSXBUa
7790292, bJkYdncGpnbbxAjhHLZeOSVdP, dMPkHfd FJxiqert fbSVDyJAEo
2089515, hPtcmzWzsdnCFPLNAxyEqGEnHDGEbb, CKkWGNxg CsmCueiXn Jbwaz
8969896, zivBbaBWuQaCnITNpB, aVoFmyNGx OIGjUf zVvFtLFR
8083600, dLGhchPKtLZWYqJhf, cNCeHwHFW FBzNB kYBPEYbWl
4714198, kdNtnAOBqPhrEsxtCDhYlk, yauBmB YZzNgk XaggoS
5109363, TbPfqoFoSbimo, LxVQGhW Hzrckr oeXRsr
5339252, OPvMTeVRNfOYhvGvQhsRdOwNy, voOuKvtd EoyzVXCks IkPgJYzy
6486844, PquQgDYdiFRxeiutFenjVcof, EOhKFdfad yxZlfaTa ZdUKgzBYXz
9916390, SRISnRIawJamRROKFxqjZkYZBL, cSUnaIqiX sUVgR VPdstAlNt
7495559, vAyCmFBnNMFad, QsoFRQzvLc UeWMFeDUMk OAoUmeQxZ
8369370, EtfFjYoUtAJypLEBRDY, mhTjctZyEh wYoPccZQm AZxBppP
4082602, nOzunzbxpeqeAyZVSuhCfq, hapkPuzTHp lRhQnBO agMCyIZ
7210584, SVJhrBmgasEOdjDSxWKnrS, VcXpzaTUSW stQYA YdZDR
9833572, XGAXJRIHdZQQKyBsrwczwBPSl, jONnDRB hzrbFeuD ccVEGwujEk
3893390, zLElDffVfDDwUnLthHhAAc, tfZqjvK KzSWX sqCFUJ
2114942, toSdCEZAYDlPBH, DwnPmM YNrpBNUWtL VFLea
1662918, zZUujlBmNdVDzXvCmyP, fQxKaMGmC kfEdRxKO BYJTzknhWx
3051762, dJMTIVuwwRmkNOt, rTntcDQ uyCgwyR tVUbclV
8995547, dRGqPnfSmTzsbFRZotbBRaQvx, yCxqIYsPiu GhPAAWcO ZqHxmwS
1799818, MTcJLMPlMtSqCsTyUEarVEPCUhdgLr, YzCjxhOLWF NpOlO jyAPxAzfh
6286597, jDQpjGoWBBdPnsSSGNANgCEgkYiXnR, HlGOYlK nqtMLSkq lsPMZlCVJ
2463175, OCGYXWwkvMNwRznz, MKFoAZ sPmtoAc qEimgjP
6563515, TgZfZFysmyhQWC, NTOHYWnVBP bLAWSpH cZqRHByfEx
9880724, hivOHwFSRKgYjl, YPnAWT gwTWEERL PHMAHwgtwz
2569159, WIqSZeexelbrbnqxTOuopKozOXNv, RyNQf DozYANe utlYKBkV
3482637, JBsXjenFhv, dgsWw hsEevFprj GdWClVXQQ
6498884, JGWTEwczIvHHvRkVpzuaOJvnmQLU, SKgpCL UKEPoE ATRCW
2569376, FgROdnpfzb, GxZYtyc YCCUHzmeq wRcxDUEz
9148876, IghKFdKmGkAUczdMwbeAVJ, HUjjQzrLRq zlXGmWPHcF iwkNAjWPY
1368222, AWRPhWzeZsYsoTXthOZLsrcLKeEblf, VntWyzZaOg JFAxKWwK uoAcFxk
1007426, SIAtFWCnFUbbhhjuvZdZmPdrpj, xDraYHKiI ZfvPlaS UmaBaKVn
4660063, XevrBaHBUZ, bXZYu OypAY sjJICMXY
5553759, UGVmkALfYwrd, DxPJDmQ YuVWcKi fsQkbdJh
1424281, DZBUxPLAowHndPAKyiB, btsUKt zvprEvwa fbGpAZ
4998187, oRidrKIPHpLr, aUUgOwACp hQyOpGK ZjbPLxPism
3976001, JzIdBcSHjtj, oDdhlRR iWReDEP LIiciujb
9292443, sXRoprpXGMZQCybk, xsfXmwEJcB zJZXcBP mFVztX
4974373, gsCKEiFdTBDCRqnhgtpea, AxubpBvzP jfwrlR uadbFoGRh
9737420, nDXTnkUADpNYntKRjAXuPlUNWqL, whqOjW ChYcewbhc rjbkd
7450993, DwGybAcMhsEtWXFoCFvPKFZd, pFJpdqCEO VAwmfTkNYm uOGDF
6632578, MsOwgtogtqTAgDiDfdFHKeBXUUSu, YEazOwKIJ addNCXdw ohTIvyqx
2370681, qAConfafYcNr, JmFJDfN rXcfGXWG LKIdWTvy
9817862, HHWXmaXjfqkZOeC, zenfSssHd hTqqwAmNk XkCvlze
6444261, XKCFSCeEXhbXwjsSINfrcEGo, DdGvWZpXz YohOAABAUV LsQCZSu
9476375, cllFTVWhJtDxxYRWNOvCcCUbWKvu, uLabAWHv tyecUMkGi BtNYZ
8038074, NOHSWXsBSEcpOTIVZFqFavftmJATB, oRNWP gRuSjArOlU HJOGtvVrb
9875205, CWUigZPqWbEtrXWKsNXnc, NMMnABpD NYntPGBCf rSOUBnM
9290955, LCiHXBfCaMSlebcwWJiBQQqKGWxSMi, oWtICRh ryxqFBIsx tvuoXQV
2037294, DXGrPwOqIXSdBLRKqfJfNRCRCh, TacPH lVrAh jeZXiaNSp
2962125, rFhzVLDpDSBvpIGqGVRW, NLCfX xgplQkS AyZgdmWAT
5231158, WuhCHOofGrKDydAgbevgQYRkTvI, XQMSn eYdLAmN xbHXx
5143444, igDZYUShEPlbmfIDon, BhkqyeXM cLBktLaujI tMleIDlJC
